name,description,address,email,phone,website,type
Giardino di piazza Centa,"Una grande farfalla blu per l’arrampicata; un’altalena pentagonale con diversi tipi di sedute e un trampolino per saltare sono solo alcuni dei giochi con cui bambini e ragazzi si possono divertire in un’area completamente nuova con pavimentazione anti-trauma in gomma blu. Il colore è stato scelto per ricordare la presenza della piscina austroungarica realizzata intorno al 1870 e ritrovata durante i lavori per la realizzazione del parcheggio pertinenziale. 
L’area giochi prevede anche uno spazio verde; dove sono installati altri giochi per l’equilibrio e una pedana tonda in legno per la pratica dello yoga o la rappresentazione di piccoli spettacoli. Sul lato nord-est del giardino sono collocati i giochi per i più grandi con l’attrezzatura per l’attività sportiva; composta da una sequenza di spalliere; pali e sbarre per un allenamento in totale sicurezza; e un canestro posizionato su un'area pavimentata presso la quale è stata ricollocata la fontanella del giardino. In un’altra area invece ci si può divertire con il ping-pong.",piazza centa; via francesco ambrosi,,,,parco / giardino
Giardino di Maso Ginocchio,"Area giochi bimbi con sabbiera; molle; altalene; arrampicata; combinati
attrezzature per lo sport: pista pattinaggio / pallavolo
superficie 9.700 m2
microarea cani con fontana acqua potabile esterna nelle vicinanze.
Il giardino; sempre molto frequentato; è stato progettato e realizzato dall’Amministrazione comunale nella seconda metà degli anni Ottanta su sollecitazione degli abitanti del rione S. Pio X; che chiedevano più verde pubblico a disposizione del quartiere.Questa area verde accoglie una pista per il pattinaggio circondata da un boschetto di ciliegi; tanti giochi per i piccoli ed alcune strutture di arrampicata per i bambini più grandi; oltre che diversi comodi tavoli ombreggiati da pergole.È inoltre presente una microarea cani con vicina abbeverata. Dal giardino si accede al nido e alla scuola materna pubblica e l’area è vicina al complesso residenziale chiamato “Vaticano” (ex case Ina) di via Muredei; costruito negli anni ’50.",ingresso giardino da via veneto; via g. giusti; via monte baldo,,,,parco / giardino
Parco Enzo Tortora - ex Area prato grande,"Attrezzature: area giochi per bambini; campo beach volley; campo basket 
Inaugurato a novembre 2019 il parco in località “Prato Grande”; in viale Verona a Madonna Bianca è stato progettato insieme alla Provincia Autonoma di Trento per essere un’area verde inclusiva e accessibile; dove chiunque possa divertirsi a prescindere dall’abilità.Nel parco sono state realizzate due aree gioco: per il beach volley in sabbia e per il basket in asfalto rivestito da resina acrilica. I viali sono stati realizzati in asfalto decolorato; con inserti di piastrelle tattili in corrispondenza delle sedute e dei luoghi utili per una segnalazione ai non vedenti. Le aree di sosta sono state pavimentate in cubetti di porfido resinati.Le aree gioco per bambini sono due; pavimentate in modo da garantire l’accessibilità anche alle carrozzine; con giochi in acciaio e legno; raggruppati in base alla fascia di età degli utilizzatori.",viale verona località prato grande,,,,parco / giardino
Cortile scuola elementare Cadine,Campo da pallacanestro - utilizzo periodo extrascolastico,piazza della regola cadine,,,,parco / giardino
