remoteId,published,modified,Titolo,Titolo breve,Immagine,Descrizione breve,Descrizione,Locandina dell'evento,Inizio,Termine,Orario,Durata,Quando,Dove,lat,lon,address,Informazioni,Destinatari,Target,Costi,Stato,Parole chiave,Circoscrizione,Tipologia di evento,Iniziativa cui fa parte,Associazione,Progressivo,Fonte,Galleria,Telefono,Fax,Email,Sito web,Valutazione dell'utente,Location,Tipologia,Tipo evento,Manifestazione collegata (numero),Manifestazione collegata (testo),Immagine correlata,Comune
d58e76f0238fc4496a16f9abd67a44bf,2018-04-08T19:30:00+02:00,2018-03-14T15:29:36+01:00,E' arrivato il Broncio,,/var/comunitavalsugana/storage/images/applicazioni5/openagenda/eventi/e-arrivato-il-broncio2/3090541-2-ita-IT/E-arrivato-il-Broncio.jpg,Al Cinema Teatro di Borgo Valsugana,,,2018-04-08T19:30:00+02:00,2018-04-08T21:30:00+02:00,Alle 19.30,,L'8 aprile 2018,"Cinema Teatro - Via XXIV maggio, 38051 Borgo Valsugana",46.053812,11.461042,"Istituto D&#039,Istruzione Alcide Degasperi, 7, Via XXIV Maggio, Borgo Valsugana, Comunit&agrave, Valsugana e Tesino, TN, Trentino-Alto Adige, 38051, ",,,Tutti,"Intero Euro 7,00 - Ridotto Euro 5,00 - Abbonamento 10 film a scelta (escluso ""Piacere del cinema"") Euro 60,00",,,,Cinema,,,,,,0461 754052,,,https://www.facebook.com/cineteatro.borgo/|Facebook,,interno,,,0.0,,,
cfa83787fd8241a516ebe4de29fc2f3c,2018-04-08T17:00:00+02:00,2018-03-14T15:19:23+01:00,E' arrivato il Broncio,,/var/comunitavalsugana/storage/images/applicazioni5/openagenda/eventi/e-arrivato-il-broncio/3090503-1-ita-IT/E-arrivato-il-Broncio.jpg,Al Cinema Teatro di Borgo Valsugana,,,2018-04-08T17:00:00+02:00,2018-04-08T19:00:00+02:00,Alle 17,,L'8 aprile 2018,"Cinema Teatro - Via XXIV maggio, 38051 Borgo Valsugana",46.053812,11.461042,"Istituto D&#039,Istruzione Alcide Degasperi, 7, Via XXIV Maggio, Borgo Valsugana, Comunit&agrave, Valsugana e Tesino, TN, Trentino-Alto Adige, 38051, ",,,Tutti,"Intero Euro 7,00 - Ridotto Euro 5,00 - Abbonamento 10 film a scelta (escluso ""Piacere del cinema"") Euro 60,00",,,,Cinema,,,,,,0461 754052,,,https://www.facebook.com/cineteatro.borgo/|Facebook,,interno,,,0.0,,,
84e5434483c3f84b2e9277427cb1ac6e,2018-04-08T10:30:00+02:00,2018-03-29T09:31:20+02:00,Festa del sole,,/var/comunitavalsugana/storage/images/applicazioni5/openagenda/eventi/festa-del-sole/3097991-1-ita-IT/Festa-del-sole.jpg,Il gruppo alpini Selva invita tutta la popolazione a festeggiare l'arrivo del sole.,Il gruppo alpini Selva invita tutta la popolazione a festeggiare l'arrivo del sole presso la sala polifunzionale di Selva di Grigno. Ricco buffet per tutti. Vi attendiamo numerosi! Durante la festa si svolgerà una lotteria con ricchi premi.,,2018-04-08T10:30:00+02:00,2018-04-08T18:00:00+02:00,A partire dalle 10.30,,L'8 aprile 2018,Selva di Grigno,46.01665,11.595211,"Strada della Marcesina, Grigno, Comunit&agrave, Valsugana e Tesino, TN, Trentino-Alto Adige, Italia",,,Tutti,Ingresso libero,,,,"Manifestazioni ed eventi,Festa,Enogastronomia",,,,,,,,,,,interno,,,0.0,,,
3890e082747c290a2bd51fa6dc3af6cc,2018-04-07T20:30:00+02:00,2018-04-03T14:29:38+02:00,Eventi adunata alpini 2018: Cori a Roncegno Terme,,/var/comunitavalsugana/storage/images/applicazioni5/openagenda/eventi/eventi-adunata-alpini-2018-cori-a-roncegno-terme/3099226-1-ita-IT/Eventi-adunata-alpini-2018-Cori-a-Roncegno-Terme.jpg,Rassegna di Cori al Palace Hotel,,http://www.comunitavalsuganaetesino.it/content/download/211511/3099229/1/locandina adunata.pdf,2018-04-07T20:30:00+02:00,2018-04-07T22:30:00+02:00,,,,,46.051623,11.410303,"Roncegno Terme, Comunit&agrave, Valsugana e Tesino, TN, Trentino-Alto Adige, 38050, Italia",,,Tutti,,,,,Concerto corale,,Comune di Roncegno Terme,,,,,,,,,interno,,,0.0,,,
b83e9f5f6110a4881da10999538e984f,2018-04-06T20:30:00+02:00,2018-03-22T16:14:34+01:00,Incontro con l'autore Pino Dellasega,,/var/comunitavalsugana/storage/images/applicazioni5/openagenda/eventi/incontro-con-l-autore-pino-dellasega/3093844-1-ita-IT/Incontro-con-l-autore-Pino-Dellasega.jpg,"Incontro di presentazione del libro &quot,Resilienti&quot,",,,2018-04-06T20:30:00+02:00,2018-04-06T22:30:00+02:00,,,,Sala del Camino di Casa Raphael - Roncegno Terme,46.051623,11.410303,"Roncegno Terme, Comunit&agrave, Valsugana e Tesino, TN, Trentino-Alto Adige, 38050, Italia",,,Tutti,gratuito,,,,"Incontri e convegni,Presentazione libro",,Comune di Roncegno Terme,,,,,,roncegno@biblio.infotn.it,,,interno,,,0.0,,,
9bac5f8a60a5b82904fb4b2d2ddc7725,2018-04-06T20:30:00+02:00,2018-03-22T18:17:30+01:00,Il senso della bellezza – Arte e Scienza al CERN,,/var/comunitavalsugana/storage/images/applicazioni5/openagenda/eventi/il-senso-della-bellezza-arte-e-scienza-al-cern/3094034-1-ita-IT/Il-senso-della-bellezza-Arte-e-Scienza-al-CERN.jpg,Pensiero in evoluzione 2018,"Un film documentario sul CERN di Ginevra del regista Valerio Jalongo, che ha sbaragliato i botteghini e si è posizionato tra i film più visti, un successo non previsto che spiega come il genere del documentario stia vivendo una seconda rinascita. ",,2018-04-06T20:30:00+02:00,2018-04-06T22:30:00+02:00,Alle 20.30,,Il 6 aprile 2018,Cinema teatro di Borgo Valsugana,46.053805,11.461106,"Istituto D&#039,Istruzione Alcide Degasperi, 7, Via XXIV Maggio, Crosetta, Olle, Borgo Valsugana, Comunit&agrave, Valsugana e Tesino, TN, Trentino-Alt","L'iniziativa nasce grazie all'intercessione e desiderio dei docenti e del direttore dell'Istituto Alcide Degasperi, della Biblioteca Borgo Valsugana e della Cassa Rurale Valsugana e Tesino.",,Tutti,Ingresso libero,,,,Cinema,Pensiero in evoluzione,,,,,,,,,,interno,,,0.0,,,
e371cf5029d8bf52e62b1d19029f91ce,2018-04-04T20:30:00+02:00,2018-03-28T10:14:00+02:00,UN ANNO DI ATTIVITA’ DEL GAL: RISULTATI RAGGIUNTI E PROSPETTIVE ,,/var/comunitavalsugana/storage/images/applicazioni5/openagenda/eventi/un-anno-di-attivita-del-gal-risultati-raggiunti-e-prospettive2/3095718-1-ita-IT/UN-ANNO-DI-ATTIVITA-DEL-GAL-RISULTATI-RAGGIUNTI-E-PROSPETTIVE.jpg,"Concluso il suo primo anno di attività con l'approvazione delle ultime graduatorie dei bandi 2017, il GAL Trentino Orientale promuove un nuovo ciclo di incontri sul territorio per informare le comunità sui risultati raggiunti e raccogliere nuove manifestazioni di interesse progettuali.","Concluso il suo primo anno di attività con l'approvazione delle ultime graduatorie dei bandi 2017, il GAL Trentino Orientale promuove un nuovo ciclo di incontri sul territorio per informare le comunità sui risultati raggiunti e raccogliere nuove manifestazioni di interesse progettuali.Le informazioni raccolte in questa nuova fase di ascolto dei portatori di interesse sarà funzionale ad aggiornare la Strategia di sviluppo locale del GAL e rendere i futuri bandi sempre più rispondenti ai fabbisogni degli operatori pubblici e privati dell'area.Il Direttore del GAL presenterà gli esiti dei bandi 2017 ed il programma di attività dell'Associazione per l'anno in corso, illustrando in particolare le modalità per segnalare al GAL nuove manifestazioni di interesse progettuali in vista della pubblicazione dei prossimi bandi Leader.",http://www.comunitavalsuganaetesino.it/content/download/211233/3095721/2/locandina_serata_Castello_Tesino_04_04_2018 (1).pdf,2018-04-04T20:30:00+02:00,2018-04-04T22:30:00+02:00,Dalle 20.30 alle 22.30,,Il 4 aprile 2018,"Palazzo Gallo, Castello Tesino",46.064465,11.632401,"Palazzo Gallo, Via Cesare Battisti, Castello Tesino, Comunit&agrave, Valsugana e Tesino, TN, Trentino-Alto Adige, 38053, Italia",,,Tutti,Ingresso gratuito,,,,Convegno,,GAL Trentino Orientale,,,,0461 1486877,,info@galtrentinorientale.it,https://www.galtrentinorientale.it/,,interno,,,0.0,,,
9a38743cc33d803cd8ffef8b661cc94d,2018-04-04T20:30:00+02:00,2018-03-14T15:17:48+01:00,Chiamami col tuo nome,,/var/comunitavalsugana/storage/images/applicazioni5/openagenda/eventi/chiamami-col-tuo-nome/3090465-1-ita-IT/Chiamami-col-tuo-nome.jpg,Al Cinema Teatro di Borgo Valsugana,,,2018-04-04T20:30:00+02:00,2018-04-04T22:30:00+02:00,Alle 20.30,,Il 4 aprile 2018,"Cinema Teatro - Via XXIV maggio, 38051 Borgo Valsugana",46.053812,11.461042,"Istituto D&#039,Istruzione Alcide Degasperi, 7, Via XXIV Maggio, Borgo Valsugana, Comunit&agrave, Valsugana e Tesino, TN, Trentino-Alto Adige, 38051, ",Piacere del cinema,,Tutti,"Intero Euro 7,00 - Ridotto Euro 5,00 - Abbonamento 10 film a scelta (escluso ""Piacere del cinema"") Euro 60,00",,,,Cinema,,,,,,0461 754052,,,https://www.facebook.com/cineteatro.borgo/|Facebook,,interno,,,0.0,,,
e19b2a37bf1ae7c227fd45b1ca09f7a8,2018-04-03T21:00:00+02:00,2018-03-23T10:24:58+01:00,4 Quartet clarinet,,/var/comunitavalsugana/storage/images/applicazioni5/openagenda/eventi/4-quartet-clarinet/3094216-1-ita-IT/4-Quartet-clarinet.jpg,I concerti del martedì,"
Mariella Scala, Ilaria Sansoni, Anna Venturini, Cristina MontresorMusiche: Mozart, Farkas, Stamitz, Bartok",http://www.comunitavalsuganaetesino.it/content/download/211186/3094219/1/CALENDARIO CONCERTI 2018.pdf,2018-04-03T21:00:00+02:00,2018-04-03T23:00:00+02:00,Alle 21,,Il 3 aprile 2018,"Casa di salute Raphael, Palace Hotel, Roncegno Terme",46.049868,11.40914,"Casa Raphael Palace Hotel, Via Waiz, Maso Vazzena, Masetti, Roncegno Terme, Comunit&agrave, Valsugana e Tesino, TN, Trentino-Alto Adige, 38051, Italia",Direzione artistica: Santo Albertini ed Edoardo Bruni,,Tutti,Ingresso libero,,,,"Musica,Musica classica",I concerti del martedì,,,,,0461 772000,,info@arsmodi.it,http://www.casaraphael.com/|www.casaraphael.com,,interno,,,0.0,,,
93cb40e28bce078a8a591f3645b7173c,2018-04-03T16:00:00+02:00,2018-03-28T14:04:05+02:00,Letture sulla vita di malga,,/var/comunitavalsugana/storage/images/applicazioni5/openagenda/eventi/letture-sulla-vita-di-malga/3096147-2-ita-IT/Letture-sulla-vita-di-malga.jpg,Letture sulla vita di malga,,,2018-04-03T16:00:00+02:00,2018-04-03T18:00:00+02:00,Alle 16,,Il 3 aprile 2018,"A.P.S.S. S. Lorenzo e S. Maria della Misericordia, Borgo Valsugana",46.05701,11.465768,"A.P.S.S. S. Lorenzo e S. Maria della Misericordia, Via per Telve, Crosetta, Olle, Borgo Valsugana, Comunit&agrave, Valsugana e Tesino, TN, Trentino-Al",,,Tutti,Ingresso libero,,,,"Mostra fotografica,Reading",La cultura delle malghe,A.P.S.P. San Lorenzo e Santa Maria della Misericordia,,,,,,,,,interno,,,0.0,,,
02a0c7aec197e56b3a9dff681669e77f,2018-04-03T14:00:00+02:00,2018-03-28T10:31:27+02:00,Soggiorni climatici al mare 2018 - Iscrizioni,,/var/comunitavalsugana/storage/images/applicazioni5/openagenda/eventi/soggiorni-climatici-al-mare-2018-iscrizioni/3088988-1-ita-IT/Soggiorni-climatici-al-mare-2018-Iscrizioni.jpg,"Il Settore Socioassistenziale della Comunità Valsugana e Tesino organizza i soggiorni climatici al mare per l’anno 2018 a Viserbella, dal 3 al 17 giugno 2018.","Il Settore Socioassistenziale della Comunità Valsugana e Tesino organizza i soggiorni climatici al mare per l’anno 2018 rivolti a:


anziani ultrasessantacinquenni,

persone che usufruiscono dei servizi di assistenza domiciliare,

invalidi civili,

persone con disabilità,

ospiti delle RSA-Case di Riposo e altre strutture residenziali,

persone segnalate dal Servizio Sociale,

persone che si trovano in particolari situazioni di disagio e di emarginazione,

persone che necessitano di un soggiorno protetto, con il fine di promuovere il loro benessere e lo sviluppo della vita di relazione.


",http://www.comunitavalsuganaetesino.it/content/download/210880/3088991/2/2687.pdf,2018-04-03T14:00:00+02:00,2018-04-16T12:00:00+02:00,,,Iscrizioni dal 3 al 16 aprile 2018,"Piazzetta Ceschi, Borgo Valsugana",46.054642,11.460071,"Palazzo Ceschi, Corso Ausugum, Crosetta, Cimond&egrave,, Borgo Valsugana, Comunit&agrave, Valsugana e Tesino, TN, Trentino-Alto Adige, 38051, Italia","
ISCRIZIONI: dal 3 al 16 aprile 
Le iscrizioni potranno essere effettuate presso gli Uffici amministrativi del Settore Socio-Assistenziale in Piazzetta Ceschi, 2 a Borgo Valsugana
dal lunedì al venerdì dalle 8.30 alle 12.00
martedì e giovedì dalle 14.00 alle 16.00.La documentazione completa e la descrizione delle modalità di partecipazione sono disponibili presso gli Uffici amministrativi del Settore Socioassistenziale.",,Anziani,,,,,"Manifestazioni ed eventi,Altro",,Comunità Valsugana e Tesino,,,,,,,,,interno,,,0.0,,,
ed11b2b39965ed16033132922a71a7d9,2018-04-02T21:00:00+02:00,2018-03-14T15:12:50+01:00,La forma dell'acqua,,/var/comunitavalsugana/storage/images/applicazioni5/openagenda/eventi/la-forma-dell-acqua3/3090313-1-ita-IT/La-forma-dell-acqua.jpg,Al Cinema Teatro di Borgo Valsugana,,,2018-04-02T21:00:00+02:00,2018-04-02T23:00:00+02:00,Alle 21,,Il 2 aprile 2018,"Cinema Teatro - Via XXIV maggio, 38051 Borgo Valsugana",46.053812,11.461042,"Istituto D&#039,Istruzione Alcide Degasperi, 7, Via XXIV Maggio, Borgo Valsugana, Comunit&agrave, Valsugana e Tesino, TN, Trentino-Alto Adige, 38051, ",,,Tutti,"Intero Euro 7,00 - Ridotto Euro 5,00 - Abbonamento 10 film a scelta (escluso ""Piacere del cinema"") Euro 60,00",,,,Cinema,,,,,,0461 754052,,,https://www.facebook.com/cineteatro.borgo/|Facebook,,interno,,,0.0,,,
f6cc65afa154449d059cd8f1adb66f0c,2018-04-02T17:00:00+02:00,2018-03-14T15:16:18+01:00,Peter Rabbit,,/var/comunitavalsugana/storage/images/applicazioni5/openagenda/eventi/peter-rabbit2/3090427-1-ita-IT/Peter-Rabbit.jpg,Al Cinema Teatro di Borgo Valsugana,,,2018-04-02T17:00:00+02:00,2018-04-02T19:00:00+02:00,Alle 17,,Il 2 aprile 2018,"Cinema Teatro - Via XXIV maggio, 38051 Borgo Valsugana",46.053812,11.461042,"Istituto D&#039,Istruzione Alcide Degasperi, 7, Via XXIV Maggio, Borgo Valsugana, Comunit&agrave, Valsugana e Tesino, TN, Trentino-Alto Adige, 38051, ",,,Tutti,"Intero Euro 7,00 - Ridotto Euro 5,00 - Abbonamento 10 film a scelta (escluso ""Piacere del cinema"") Euro 60,00",,,,Cinema,,,,,,0461 754052,,,https://www.facebook.com/cineteatro.borgo/|Facebook,,interno,,,0.0,,,
588f4c8336a5e30cd87e4e95b1743fc8,2018-04-02T10:30:00+02:00,2018-03-28T12:03:37+02:00,Tiro all'ovo,,/var/comunitavalsugana/storage/images/applicazioni5/openagenda/eventi/tiro-all-ovo/3097360-1-ita-IT/Tiro-all-ovo.jpg,A Ospedaletto,"Dopo la messa delle 10, Tiro all'ovo, iscrizioni sul posto, fantastici premi",,2018-04-02T10:30:00+02:00,2018-04-02T12:30:00+02:00,Alle 10.30,,Il 2 aprile 2018,Ospedaletto,46.044017,11.552306,"Sant&#039,Egidio abate, Via Roma, Pradanella, Ospedaletto, Comunit&agrave, Valsugana e Tesino, TN, Trentino-Alto Adige, 38059, Italia",,,Tutti,,,,,"Folklore,Manifestazioni ed eventi",,,,,,,,,https://www.facebook.com/Pro-Loco-Ospedaletto-376067466193903/|Facebook,,interno,,,0.0,,,
eb1393d0e7ab68a5a90bec2df3f2649a,2018-04-02T09:00:00+02:00,2018-03-21T11:24:05+01:00,Benedizione delle moto,,/var/comunitavalsugana/storage/images/applicazioni5/openagenda/eventi/benedizione-delle-moto/3093072-1-ita-IT/Benedizione-delle-moto.jpg,Organizza il Moto Club C3 Excelsior ASD,A partire dalle 9 con buffet di benvenuto a tutti i motociclisti. Benedizione alle 11. Conclusione della manifestazione alle 15.,,2018-04-02T09:00:00+02:00,2018-04-02T15:00:00+02:00,A partire dalle 9,,Il 2 aprile 2018,"Oratorio Bellesini, Borgo Valsugana",46.053023,11.460527,"Sugana Valley, Strada Statale 47 della Valsugana, Pradanella, Ospedaletto, Comunit&agrave, Valsugana e Tesino, TN, Trentino-Alto Adige, Italia",,,Tutti,,,,,"Manifestazioni ed eventi,Festa",,,,,,,,,https://www.facebook.com/Motoclub-C-3-Excelsior-113988775407195|Facebook,,interno,,,0.0,,,
daa984bc7057df014b7eb28bf2e8c1c6,2018-04-01T21:00:00+02:00,2018-03-14T15:12:13+01:00,La forma dell'acqua,,/var/comunitavalsugana/storage/images/applicazioni5/openagenda/eventi/la-forma-dell-acqua2/3090275-1-ita-IT/La-forma-dell-acqua.jpg,Al Cinema Teatro di Borgo Valsugana,,,2018-04-01T21:00:00+02:00,2018-04-01T23:00:00+02:00,Alle 21,,L'1 aprile 2018,"Cinema Teatro - Via XXIV maggio, 38051 Borgo Valsugana",46.053812,11.461042,"Istituto D&#039,Istruzione Alcide Degasperi, 7, Via XXIV Maggio, Borgo Valsugana, Comunit&agrave, Valsugana e Tesino, TN, Trentino-Alto Adige, 38051, ",,,Tutti,"Intero Euro 7,00 - Ridotto Euro 5,00 - Abbonamento 10 film a scelta (escluso ""Piacere del cinema"") Euro 60,00",,,,Cinema,,,,,,0461 754052,,,https://www.facebook.com/cineteatro.borgo/|Facebook,,interno,,,0.0,,,
73746777396fbfeee801fff376d65a6c,2018-04-01T17:00:00+02:00,2018-03-14T15:15:09+01:00,Peter Rabbit,,/var/comunitavalsugana/storage/images/applicazioni5/openagenda/eventi/peter-rabbit/3090351-2-ita-IT/Peter-Rabbit.jpg,Al Cinema Teatro di Borgo Valsugana,,,2018-04-01T17:00:00+02:00,2018-04-01T19:00:00+02:00,Alle 17,,L'1 aprile 2018,"Cinema Teatro - Via XXIV maggio, 38051 Borgo Valsugana",46.053812,11.461042,"Istituto D&#039,Istruzione Alcide Degasperi, 7, Via XXIV Maggio, Borgo Valsugana, Comunit&agrave, Valsugana e Tesino, TN, Trentino-Alto Adige, 38051, ",,,Tutti,"Intero Euro 7,00 - Ridotto Euro 5,00 - Abbonamento 10 film a scelta (escluso ""Piacere del cinema"") Euro 60,00",,,,Cinema,,,,,,0461 754052,,,https://www.facebook.com/cineteatro.borgo/|Facebook,,interno,,,0.0,,,
c76a491e33bbee7e6d945b069a6c984b,2018-03-31T22:00:00+02:00,2018-03-05T17:56:32+01:00,Yellow night,,/var/comunitavalsugana/storage/images/applicazioni5/openagenda/eventi/yellow-night/3087321-1-ita-IT/Yellow-night.jpg,Apertura straordinaria fino alle 24.00 per festeggiare insieme la chiusura della campagna.,,http://www.comunitavalsuganaetesino.it/content/download/210809/3087324/2/2629.pdf,2018-03-31T22:00:00+02:00,2018-03-31T23:59:00+02:00,Dalle 22.00 alle 24.00,Due ore,Il 31 marzo 2018,"Centro attività motorie. Località Prai de ponte, 1 - Scurelle",46.056121,11.512614,"Centro attivit&agrave, motorie, 1, Strada dell&#039,artigianato, Castellare, Pagela, Scurelle, Comunit&agrave, Valsugana e Tesino, TN, Trentino-Alto A",,,Tutti,,,,,Sport,Let s move,,,,,347 3784182,,,,,interno,,,0.0,,,
32f62e8208e67d83e1ba11e6d28888f3,2018-03-31T21:00:00+02:00,2018-03-14T15:10:09+01:00,La forma dell'acqua,,/var/comunitavalsugana/storage/images/applicazioni5/openagenda/eventi/la-forma-dell-acqua/3090237-1-ita-IT/La-forma-dell-acqua.jpg,Al Cinema Teatro di Borgo Valsugana,,,2018-03-31T21:00:00+02:00,2018-03-31T23:00:00+02:00,Alle 21,,Il 31 marzo 2018,"Cinema Teatro - Via XXIV maggio, 38051 Borgo Valsugana",46.053812,11.461042,"Istituto D&#039,Istruzione Alcide Degasperi, 7, Via XXIV Maggio, Borgo Valsugana, Comunit&agrave, Valsugana e Tesino, TN, Trentino-Alto Adige, 38051, ",,,Tutti,"Intero Euro 7,00 - Ridotto Euro 5,00 - Abbonamento 10 film a scelta (escluso ""Piacere del cinema"") Euro 60,00",,,,Cinema,,,,,,0461 754052,,,https://www.facebook.com/cineteatro.borgo/|Facebook,,interno,,,0.0,,,
5cb11bd4a028b2273c5e250c8cb63dea,2018-03-31T14:30:00+02:00,2018-03-05T17:56:01+01:00,Family day. Move your family,,/var/comunitavalsugana/storage/images/applicazioni5/openagenda/eventi/family-day.-move-your-family4/3087169-1-ita-IT/Family-day.-Move-your-family.jpg,I genitori si allenano e i figli si divertono con baby dance e attività ludico ricreative per tutte le età.,,http://www.comunitavalsuganaetesino.it/content/download/210805/3087172/2/2629.pdf,2018-03-31T14:30:00+02:00,2018-03-31T18:30:00+02:00,Dalle 14.30 alle 18.30,Quattro ore,Il 31 marzo 2018,"Centro attività motorie. Località Prai de ponte, 1 - Scurelle",46.056121,11.512614,"Centro attivit&agrave, motorie, 1, Strada dell&#039,artigianato, Castellare, Pagela, Scurelle, Comunit&agrave, Valsugana e Tesino, TN, Trentino-Alto A",,,Tutti,Servizio gratuito per tutti,,,,Sport,Let s move,,,,,347 3784182,,,,,interno,,,0.0,,,
203fd535d75bd20f7739405d93ef26d0,2018-03-31T11:00:00+02:00,2018-03-03T10:23:39+01:00,Alessandro Cristeli,,/var/comunitavalsugana/storage/images/applicazioni5/openagenda/eventi/alessandro-cristeli/3085845-1-ita-IT/Alessandro-Cristeli.jpg,"Aspettando la primavera. Cinque appuntamenti live music&amp,aperitivo. Pianoforte solo. Omaggio al romanticismo, musica da camera classica.",,,2018-03-31T11:00:00+02:00,2018-03-31T13:00:00+02:00,Alle 11,,Il 31 marzo 2018,"Piscina della Comunità, Via Gozzer 52 - Borgo Valsugana",46.050793,11.467602,"piscina, Via Giuseppe Gozzer, Crosetta, Olle, Borgo Valsugana, Comunit&agrave, Valsugana e Tesino, TN, Trentino-Alto Adige, 38051, Italia","
Con degustazione vini e buffet.
Evento gratuito, consumazioni escluse.
In caso di pioggia o condizioni atmosferiche avverse i concerti non verranno posticipati.Direzione artistica Nicola Sartori, in collaborazione con Giusy Locatelli.",,Tutti,Ingresso libero,,,,"Musica,Concerto classico",Aspettando la primavera,,,,,0461 751227,,info@rarinantesvalsugana.it,https://www.rarinantesvalsugana.com/|www.rarinantesvalsugana.com,,interno,,,0.0,,,
47f161bcd1a1bb2227cbcf7973db7895,2018-03-30T20:30:00+02:00,2018-03-21T08:55:56+01:00,La pernice volò,,/var/comunitavalsugana/storage/images/applicazioni5/openagenda/eventi/la-pernice-volo/3092883-1-ita-IT/La-pernice-volo.jpg,Presentazione del libro,"Presentazione del libro &quot,La pernice volò&quot,. Dialogo con l'autrice Juli Moranduzzo su scrittura, poesia e fotografia. Al 3nto di Bieno.",,2018-03-30T20:30:00+02:00,2018-03-30T22:30:00+02:00,Alle 20.30,,Il 30 marzo 2018,"3nto, Bieno",46.080204,11.552875,"Trento, Strada Provinciale 78 del Tesino, Zunaghe, Bieno, Comunit&agrave, Valsugana e Tesino, TN, Trentino-Alto Adige, 38059, Italia",,,Tutti,Ingresso libero,,,,"Incontri e convegni,Presentazione libro",,,,,,,,,,,interno,,,0.0,,,
26a6746918a9979499ef85d033fcac39,2018-03-30T07:00:00+02:00,2018-03-05T17:55:28+01:00,Disco e rock gym,,/var/comunitavalsugana/storage/images/applicazioni5/openagenda/eventi/disco-e-rock-gym3/3087283-1-ita-IT/Disco-e-rock-gym.jpg,"Allenati con noi a tempo di musica in una atmosfera &quot,particolare&quot,.",,http://www.comunitavalsuganaetesino.it/content/download/210808/3087286/2/2629.pdf,2018-03-30T07:00:00+02:00,2018-03-30T22:00:00+02:00,Dalle 7.00 alle 22.00,,Il 23 marzo 2018,"Centro attività motorie. Località Prai de ponte, 1 - Scurelle",46.056121,11.512614,"Centro attivit&agrave, motorie, 1, Strada dell&#039,artigianato, Castellare, Pagela, Scurelle, Comunit&agrave, Valsugana e Tesino, TN, Trentino-Alto A",,,Tutti,,,,,Sport,Let s move,,,,,347 3784182,,,,,interno,,,0.0,,,
5354d6c12a070061886ea9d7b9490b6f,2018-03-28T20:30:00+02:00,2018-02-26T15:10:14+01:00,Mr. Ove,,/var/comunitavalsugana/storage/images/applicazioni5/openagenda/eventi/mr.-ove/3084159-1-ita-IT/Mr.-Ove.jpg,Al Cinema Teatro di Borgo Valsugana,,,2018-03-28T20:30:00+02:00,2018-03-28T22:30:00+02:00,Alle 20.30,,,"Cinema Teatro - Via XXIV maggio, 38051 Borgo Valsugana",46.053812,11.461042,"Istituto D&#039,Istruzione Alcide Degasperi, 7, Via XXIV Maggio, Borgo Valsugana, Comunit&agrave, Valsugana e Tesino, TN, Trentino-Alto Adige, 38051, ",,,Tutti,"Intero Euro 7,00 - Ridotto Euro 5,00 - Abbonamento 10 film a scelta (escluso ""Piacere del cinema"") Euro 60,00",,,,Cinema,Piacere del cinema,,,,,0461 754052,,,https://www.facebook.com/cineteatro.borgo/|Facebook,,interno,,,0.0,,,
753d7afc810549aa367c30b028022e93,2018-03-27T21:00:00+02:00,2018-03-23T10:23:13+01:00,Romanze dal cuor,,/var/comunitavalsugana/storage/images/applicazioni5/openagenda/eventi/romanze-dal-cuor/3094159-1-ita-IT/Romanze-dal-cuor.jpg,I concerti del martedì,"
Paola Fumana: sopranoChiara Brun: arpa",http://www.comunitavalsuganaetesino.it/content/download/211184/3094162/1/CALENDARIO CONCERTI 2018.pdf,2018-03-27T21:00:00+02:00,2018-03-27T23:00:00+02:00,Alle 21,,Il 27 marzo 2018,"Casa di salute Raphael, Palace Hotel, Roncegno Terme",46.049868,11.40914,"Casa Raphael Palace Hotel, Via Waiz, Maso Vazzena, Masetti, Roncegno Terme, Comunit&agrave, Valsugana e Tesino, TN, Trentino-Alto Adige, 38051, Italia",Direzione artistica: Santo Albertini ed Edoardo Bruni,,Tutti,Ingresso libero,,,,"Musica,Musica classica",I concerti del martedì,,,,,0461 772000,,info@arsmodi.it,http://www.casaraphael.com/|www.casaraphael.com,,interno,,,0.0,,,
817447a28d02ee74b8ac3df4508cf586,2018-03-27T20:00:00+02:00,2018-02-26T10:39:52+01:00,"Lezioni di avvicinamento all'astronomia: sistema solare, seconda parte",,/var/comunitavalsugana/storage/images/applicazioni5/openagenda/eventi/lezioni-di-avvicinamento-all-astronomia-sistema-solare-seconda-parte/3083335-3-ita-IT/Lezioni-di-avvicinamento-all-astronomia-sistema-solare-seconda-parte.jpg,Con il prof. Giancarlo Favero,"Associazione Ecomuseo del Lagorai e Unione Astrofili Tesino e Valsugana organizzano le &quot,Lezioni di avvicinamento all'astronomia&quot, con il prof. Giancarlo Favero.",,2018-03-27T20:00:00+02:00,2018-03-27T22:00:00+02:00,,,A partire dal 20 marzo 2018,"Sala dei Volti, Carzano",46.070325,11.493343,"Carzano, Comunit&agrave, Valsugana e Tesino, TN, Trentino-Alto Adige, Italia",,,Tutti,,,,,Corso,Lezioni di avvicinamento alla astronomia,,,,,340 3950039,,info@ecomuseolagorai.eu,https://www.ecomuseolagorai.eu/|www.ecomuseolagorai.eu,,interno,,,0.0,,,
53fd895428135942eac02c429098e16d,2018-03-27T16:00:00+02:00,2018-03-24T15:36:31+01:00,"Letture da ""Storie dell'altipiano"" di Mario Rigoni Stern",,/var/comunitavalsugana/storage/images/applicazioni5/openagenda/eventi/letture-da-storie-dell-altipiano-di-mario-rigoni-stern/3096109-1-ita-IT/Letture-da-Storie-dell-altipiano-di-Mario-Rigoni-Stern.jpg,"Letture da &quot,Storie dell'altipiano&quot, di Mario Rigoni Stern",,,2018-03-27T16:00:00+02:00,2018-04-27T18:00:00+02:00,Alle 16,,Il 27 marzo 2018,"A.P.S.S. S. Lorenzo e S. Maria della Misericordia, Borgo Valsugana",46.05701,11.465768,"A.P.S.S. S. Lorenzo e S. Maria della Misericordia, Via per Telve, Crosetta, Olle, Borgo Valsugana, Comunit&agrave, Valsugana e Tesino, TN, Trentino-Al",,,Tutti,Ingresso libero,,,,"Mostra fotografica,Reading",La cultura delle malghe,A.P.S.P. San Lorenzo e Santa Maria della Misericordia,,,,,,,,,interno,,,0.0,,,
