9d94d0110a3df5f75708ce6323111e10,2018-04-27T20:30:00+02:00,2018-04-11T09:15:18+02:00,Adesso o mai più,,/var/comunitavalsugana/storage/images/applicazioni5/openagenda/eventi/adesso-o-mai-piu4/3101840-1-ita-IT/Adesso-o-mai-piu.jpg,Interventi concreti per la tua abitazione e il tuo territorio,Serata pubblica di presentazione delle nuove opportunità relative ai contributi per la ristrutturazione e acquisto casa. Interverrà l'assessore provinciale Carlo Daldoss.,,2018-04-27T20:30:00+02:00,2018-04-27T22:30:00+02:00,Alle 20.30,,Il 27 aprile 2018,"Auditorium della Comunità, Borgo Valsugana",46.054694,11.459899,"Palazzo Ceschi, Corso Ausugum, Crosetta, Cimond&egrave,, Borgo Valsugana, Comunit&agrave, Valsugana e Tesino, TN, Trentino-Alto Adige, 38051, Italia",,,Tutti,Ingresso libero,,,,"Incontri e convegni,Convegno",Adesso o mai più,,,,,,,,,,interno,,,0.0,,,
7b886ad6bec5e3e6e972b11ceb100135,2018-04-27T20:30:00+02:00,2018-04-26T10:09:54+02:00,"Presentazione del libro ""Il quaderno del destino""",,/var/comunitavalsugana/storage/images/applicazioni5/openagenda/eventi/presentazione-del-libro-il-quaderno-del-destino/3105387-1-ita-IT/Presentazione-del-libro-Il-quaderno-del-destino.jpg,"In occasione della giornata mondiale del libro e del diritto d'autore, si terrà presso la Biblioteca comunale Albano Tomaselli di Castel Ivano la presentazione del libro &quot,Il quaderno del destino&quot,.Sarà presente l'autrice del libro, Martina Dei Cas, assieme al regista Luca Sartori, che ha realizzato un cortometraggio sul libro.",,http://www.comunitavalsuganaetesino.it/content/download/212082/3105390/3/Locandina Il quaderno del destino.pdf,2018-04-27T20:30:00+02:00,2018-04-27T22:30:00+02:00,Alle ore 20.30,,Venerdì 27 aprile 2018,,46.065876,11.52204,"Biblioteca comunale, Piazzetta Luigi Carbonari, Strigno, Castel Ivano, Comunit&agrave, Valsugana e Tesino, TN, Trentino-Alto Adige, 38059, Italia",,,Tutti,,,,,"Incontri e convegni,Presentazione libro",Il maggio dei libri,Comune di Castel Ivano,,,,,,,,,interno,,,0.0,,,
df7fcc201cab5c93044cf602813c8b55,2018-04-25T17:30:00+02:00,2018-04-11T09:00:36+02:00,"Belle & Sebastien, amici per sempre",,/var/comunitavalsugana/storage/images/applicazioni5/openagenda/eventi/belle-sebastien-amici-per-sempre2/3101252-2-ita-IT/Belle-Sebastien-amici-per-sempre.jpg,"Film: Belle &amp, Sebastien, amici per sempre.","Film: Belle &amp, Sebastien, amici per sempre. Cinema teatro Castello Tesino.Domenica 22 aprile ore 17,30, Marted' 24 aprile ore 21, Mercoled' 25 aprile ore 17,30",http://www.comunitavalsuganaetesino.it/content/download/211709/3101255/2/BELLE.jpg,2018-04-25T17:30:00+02:00,2018-04-25T19:15:00+02:00,"Dalle ore 17,30 alle ore 19,15",,Mercoledì 25 aprile 2018,presso Cinema teatro Castello Tesino,46.062839,11.632676,"Cinema teatro San Giorgio, Strada Provinciale 75 del Grigno, Castello Tesino, Comunit&agrave, Valsugana e Tesino, TN, Trentino-Alto Adige, 38053, Ital",,,Famiglia,"Intero: € 7,50, Ridotto: € 5,00",,,,Cinema,,ASSOCIAZIONE PER LA COMUNICAZIONE SOCIALE - CASTELLO TESINO,,,,333-2617118,,paolosordo@libero.it,,,interno,,,0.0,,,
998ac63d36cdaf347064cf1f0570f7eb,2018-04-25T14:00:00+02:00,2018-03-27T11:34:09+02:00,Gara dei TRE COLLI - Gara di corsa su strada,,/var/comunitavalsugana/storage/images/applicazioni5/openagenda/eventi/gara-dei-tre-colli-gara-di-corsa-su-strada/3096637-1-ita-IT/Gara-dei-TRE-COLLI-Gara-di-corsa-su-strada.jpg,"L’Unione sportiva Castel Ivano organizza la Gara dei Tre colliOttavo Trofeo Cassa Rurale Valsugana e Tesino, prima prova finale provinciale CSI di corsa su strada
Gara interregionale che si terrà a Castel Ivano, frazione di Agnedo (TN), mercoledì 25 aprile 2018.Le gare saranno disputate ad Agnedo con ritrovo alle ore 14.00 in piazza Beata Vergine della Mercede e inizio delle gare alle ore 14.30.","L’Unione sportiva Castel Ivano organizza, con l’approvazione del Centro Sportivo Italiano, il patrocinio del Comune di Castel Ivano, della Comunità di valle Valsugana e Tesino, della Provincia autonoma di Trento e del BIM Brenta, in collaborazione con le associazioni del paese, la Gara dei Tre colli - Ottavo Trofeo Cassa Rurale Valsugana e Tesino, prima prova finale provinciale CSI di corsa su strada, gara interregionale che si terrà a Castel Ivano, frazione di Agnedo (TN), mercoledì 25 aprile 2018. Le gare saranno disputate ad Agnedo con ritrovo alle ore 14 in piazza Beata Vergine della Mercede e inizio delle gare alle ore 14.30. Alle gare possono partecipare tutti gli atleti/e tesserati CSI per le società del Trentino - Alto Adige, Veneto, Lombardia e tutti i possessori di altra tessera (FIDAL o altro EPS) validamente utilizzabile secondo le vigenti convenzioni FIDAL/CSI - CSI/altri EPS.",http://www.comunitavalsuganaetesino.it/content/download/211313/3096640/7/pieghevole3colli2018WEB.pdf,2018-04-25T14:00:00+02:00,2018-04-25T18:00:00+02:00,dalle 14.00 alle 19.00,,mercoledì 25 aprile 2018,Piazza di Agnedo,46.05284,11.528692,"Piazza Beata Vergine della Mercede, Ivano, Castrozze, Castel Ivano, Comunit&agrave, Valsugana e Tesino, TN, Trentino-Alto Adige, 38059, Italia","ISCRIZIONIPer tutte le categorie le iscrizioni devono essere effettuate ESCLUSIVAMENTE online nel portale CSI entro domenica 22 aprile 2018. Solo per le società e gli atleti fuori provincia è ammessa l’iscrizione via email all’indirizzo garatrecolli@gmail.com. Per eventuali info: Antonio 3285630390. Le iscrizioni sono gratuite e i numeri di gara saranno assegnati dagli organizzatori.PREMI INDIVIDUALIPacco gara a tutti gli atleti classificati (maglietta e prodotti tipici locali). Saranno premiati i primi 5 atleti classificati di ogni categoria e i primi dieci cuccioli/e, esordienti/e, ragazzi/e.PREMI DI SOCIETÀ
Trofeo Cassa Rurale Valsugana e Tesino alla prima società classificata. Coppa o targa dalla seconda alla decima società classificata. Per la classifica di società verranno assegnati i punteggi previsti dal TUTTO CSI 2018 per il campionato provinciale. Dalle ore 18.00 circa premiazioni delle categorie assolute e società.Pur avendo cura della buona riuscita della manifestazione gli organizzatori declinano ogni responsabilità in caso di qualsiasi incidente, danno o altro che dovesse verificarsi prima, durante e dopo lo svolgimento delle gare. Per quanto non contemplato nel presente regolamento si fa riferimento alle norme CSI attualmente in vigore.",,Tutti,la partecipazione gratuita,,,,"Sport,Atletica leggera",,"Associazione Nazionale Alpini - gruppo Villa Agnedo Ivano Fracena
US Castel Ivano",,,"Gara tre colli
Orari",Antonio 328 5630390,,garatrecolli@gmail.com,,,esterno,,,0.0,,,
40d66a597024a181d80dcce9909f98cb,2018-04-25T08:00:00+02:00,2018-04-19T10:10:36+02:00,Fiera di San Marco,,/var/comunitavalsugana/storage/images/applicazioni5/openagenda/eventi/fiera-di-san-marco/3103943-1-ita-IT/Fiera-di-San-Marco.jpg,"Fiera/mercato dei fiori, piante, giardinaggio e attrezzatura per la gestione del verde","Fiera/mercato dei fiori, piante, giardinaggio e attrezzatura per la gestione del verde",,2018-04-25T08:00:00+02:00,2018-04-25T13:00:00+02:00,A partire dalle 8,,Il 25 aprile 2018,"Piazza Municipio, Castel Ivano (Strigno)",46.066357,11.523322,"Piazza Municipio, Ivano, Pellegrini, Castel Ivano, Comunit&agrave, Valsugana e Tesino, TN, Trentino-Alto Adige, 38059, Italia",,,Tutti,,,,,"Manifestazioni ed eventi,Fiera",,"Comune di Castel Ivano
Ecomuseo della Valsugana - Dalle sorgenti di Rava al Brenta",,,,,,,,,interno,,,0.0,,,
6cb901c8b457fa1d023537c8e9f7b684,2018-04-24T21:00:00+02:00,2018-04-10T18:12:10+02:00,"Film: Belle & Sebastien, amici per sempre",,/var/comunitavalsugana/storage/images/applicazioni5/openagenda/eventi/film-belle-sebastien-amici-per-sempre2/3101214-1-ita-IT/Film-Belle-Sebastien-amici-per-sempre.jpg,"Film: Belle &amp, Sebastien, amici per sempre.","Film: Belle &amp, Sebastien, amici per sempre. Cinema teatro Castello Tesino.Domenica 22 aprile ore 17,30, Marted' 24 aprile ore 21, Mercoled' 25 aprile ore 17,30",http://www.comunitavalsuganaetesino.it/content/download/211708/3101217/1/BELLE.jpg,2018-04-24T21:00:00+02:00,2018-04-24T22:45:00+02:00,"Dalle ore 21 alle ore 22,45",,Martedì 24 aprile 2018,presso Cinema teatro Castello Tesino,46.062839,11.632676,"Cinema teatro San Giorgio, Strada Provinciale 75 del Grigno, Castello Tesino, Comunit&agrave, Valsugana e Tesino, TN, Trentino-Alto Adige, 38053, Ital",,,Famiglia,"Intero: € 7,50, Ridotto: € 5,00",,,,Cinema,,ASSOCIAZIONE PER LA COMUNICAZIONE SOCIALE - CASTELLO TESINO,,,,333-2617118,,paolosordo@libero.it,,,interno,,,0.0,,,
2cb5b684c1c01232bf99360ac0e53ea3,2018-04-24T21:00:00+02:00,2018-03-23T10:29:52+01:00,Ars Harmonicale,,/var/comunitavalsugana/storage/images/applicazioni5/openagenda/eventi/ars-harmonicale/3094330-1-ita-IT/Ars-Harmonicale.jpg,I concerti del martedì,"
Stefano Bellini, Victor Lozano, Piercarlo Torri: violini
Emanuela Bungaro: violino, viola
Filippo Degasperi: viola
Dora Cainelli e Adele Pardi: violoncelli
Chiara Saiani: clavicembaloMusiche: J.S. Bach, F. Pierami, A. Piazzolla",http://www.comunitavalsuganaetesino.it/content/download/211189/3094333/1/CALENDARIO CONCERTI 2018.pdf,2018-04-24T21:00:00+02:00,2018-04-24T23:00:00+02:00,Alle 21,,Il 24 aprile 2018,"Casa di salute Raphael, Palace Hotel, Roncegno Terme",46.049868,11.40914,"Casa Raphael Palace Hotel, Via Waiz, Maso Vazzena, Masetti, Roncegno Terme, Comunit&agrave, Valsugana e Tesino, TN, Trentino-Alto Adige, 38051, Italia",Direzione artistica: Santo Albertini ed Edoardo Bruni,,Tutti,Ingresso libero,,,,Musica,I concerti del martedì,,,,,0461 772000,,info@arsmodi.it,http://www.casaraphael.com/|www.casaraphael.com,,interno,,,0.0,,,
fc8cb6690bae97e86256151081750619,2018-04-24T20:30:00+02:00,2018-04-23T10:29:47+02:00,Zapping!,,/var/comunitavalsugana/storage/images/applicazioni5/openagenda/eventi/zapping/3104923-1-ita-IT/Zapping.jpg,"Sabato sera: Jessica deve preparare entro lunedì una breve tesina sul rapporto dei giovani con i mass media negli ultimi 50 anni, ma non riesce a concentrarsi. Emma, la sua migliore amica, viene a chiamarla per uscire insieme. Davanti alle resistenze di Jessica, Emma decide di fermarsi ad aiutarla e così entrano nel mondo della TV attraverso il computer. Tra risate, confidenze e riflessioni la tesina comincia a prendere forma...Spettacolo inserito nell'evento &quot,Un calcio all'indifferenza&quot,. Dedicato a David Micheletti",,,2018-04-24T20:30:00+02:00,2018-04-24T22:30:00+02:00,Dalle 20.30 alle 22.30,,Martedì 24 aprile 2018,"Teatro don Bosco, Telve Valsugana",46.070432,11.479383,"Teatro parrocchiale Telve, Via S. Giustina, Nale, Batistoti, Telve, Comunit&agrave, Valsugana e Tesino, TN, Trentino-Alto Adige, 38051, Italia",,,Tutti,,,,,Teatro,,Figli delle Stelle,,,,,,ass.teatrale.figlidellestelle@gmail.com,http://www.teatrofiglidellestelle.it/zapping.html,,interno,,,0.0,,,
848d343f6e274b1c17d69ea19038ec5d,2018-04-23T20:30:00+02:00,2018-04-13T10:32:49+02:00,Conosciamo il lupo e l'orso,,/var/comunitavalsugana/storage/images/applicazioni5/openagenda/eventi/conosciamo-il-lupo-e-l-orso/3102845-1-ita-IT/Conosciamo-il-lupo-e-l-orso.jpg,"L'Assessorato all'agricoltura della Provincia Autonoma di Trento, in collaborazione con il Comune di Castel Ivano, organizza per lunedì 23 aprile, alle ore 20.30 (presso il Centro Sociale di Agnedo), una serata di approfondimento sul tema dei grandi carnivori.","L'Assessorato all'agricoltura, alle foreste, al turismo e promozione, alla caccia e alla pesca della Provincia Autonoma di Trento, in collaborazione con il Comune di Castel Ivano, organizza una serata di approfondimento e di conoscenza sui grandi carnivori, quali l'orso e il lupo.Saranno presenti l'assessore provinciale Michele Dallapiccola e il dott. Claudio Groff del Servizio Foreste e Fauna della PAT.",,2018-04-23T20:30:00+02:00,2018-04-23T23:30:00+02:00,,,,,46.056094,11.524825,"Centro Polifunzionale, Via don Giuseppe Grazioli, Agnedo, Castel Ivano, Comunit&agrave, Valsugana e Tesino, TN, Trentino-Alto Adige, 38059, Italia",,,Tutti,,,,,Incontri e convegni,,Comune di Castel Ivano,,,,,,,,,interno,,,0.0,,,
514e030b45c33fcb2972df9dd9fdecb8,2018-04-22T20:30:00+02:00,2018-03-14T15:24:38+01:00,Tomb raider,,/var/comunitavalsugana/storage/images/applicazioni5/openagenda/eventi/tomb-raider2/3090731-1-ita-IT/Tomb-raider.jpg,Al Cinema Teatro di Borgo Valsugana,,,2018-04-22T20:30:00+02:00,2018-04-22T22:30:00+02:00,Alle 20.30,,Il 22 aprile 2018,"Cinema Teatro - Via XXIV maggio, 38051 Borgo Valsugana",46.053812,11.461042,"Istituto D&#039,Istruzione Alcide Degasperi, 7, Via XXIV Maggio, Borgo Valsugana, Comunit&agrave, Valsugana e Tesino, TN, Trentino-Alto Adige, 38051, ",,,Tutti,"Intero Euro 7,00 - Ridotto Euro 5,00 - Abbonamento 10 film a scelta (escluso ""Piacere del cinema"") Euro 60,00",,,,Cinema,,,,,,0461 754052,,,https://www.facebook.com/cineteatro.borgo/|Facebook,,interno,,,0.0,,,
ff928b552c07aa01ee8757cfe07c3013,2018-04-22T17:30:00+02:00,2018-04-10T18:05:19+02:00,"FILM: BELLE & SEBASTIEN, AMICI PER SEMPRE",,/var/comunitavalsugana/storage/images/applicazioni5/openagenda/eventi/film-belle-sebastien-amici-per-sempre/3101176-1-ita-IT/FILM-BELLE-SEBASTIEN-AMICI-PER-SEMPRE.jpg,"Film: Belle &amp, Sebastien, amici per sempre. Cinema teatro Castello Tesino. Film per la famiglia.","Film: Belle &amp, Sebastien, amici per sempre. Cinema teatro Castello Tesino. Film per la famiglia.Domenica 22 aprile ore 17,30, Martedì 24 aprile ore 21, Mercoledì 25 aprile ore 17,30 Nel terzo capitolo delle avventure cinematografiche di Belle &amp, Sebastien, Sebastien è cresciuto, ha 12 anni e con Belle sono ancora inseparabili, anzi la famiglia si è allargata con l'arrivo di tre splendidi cuccioli di cui Sebastien si prende cura con tanta buona volontà. Una sera a casa del nonno ascolta una conversazione tra Pierre, suo padre, ed Angelina, da poco sposi, scoprendo le loro intenzioni di trasferirsi presto in Canada. Sebastien è amareggiato, non vuole lasciare il nonno che invece lo sprona a scoprire il mondo. La situazione si complica con l'arrivo di un presunto proprietario di Belle che vuole portargliela via, ma Sebastien è testardo e farà di tutto per non separarsi dalla sua migliore amica a quattro zampe.",http://www.comunitavalsuganaetesino.it/content/download/211707/3101179/1/BELLE.jpg,2018-04-22T17:30:00+02:00,2018-04-22T19:15:00+02:00,"dalle ore 17,30 alle ore 19,15",,Domenica 22 aprile 2018,presso Cinema-Teatro Castello Tesino,46.062839,11.632676,"Cinema teatro San Giorgio, Strada Provinciale 75 del Grigno, Castello Tesino, Comunit&agrave, Valsugana e Tesino, TN, Trentino-Alto Adige, 38053, Ital",,,Famiglia,"Ingresso: Intero € 7,50, Ridotto (over 65 e under 12) € 5,00",,,,Cinema,,ASSOCIAZIONE PER LA COMUNICAZIONE SOCIALE - CASTELLO TESINO,,,,333-2617118,,paolosordo@libero.it,,,interno,,,0.0,,,
148357eb0ebb30ea2fcd12bd13d6f6d3,2018-04-22T17:00:00+02:00,2018-03-14T15:23:58+01:00,Tomb raider,,/var/comunitavalsugana/storage/images/applicazioni5/openagenda/eventi/tomb-raider/3090693-1-ita-IT/Tomb-raider.jpg,Al Cinema Teatro di Borgo Valsugana,,,2018-04-22T17:00:00+02:00,2018-04-22T19:00:00+02:00,Alle 17,,Il 22 aprile 2018,"Cinema Teatro - Via XXIV maggio, 38051 Borgo Valsugana",46.053812,11.461042,"Istituto D&#039,Istruzione Alcide Degasperi, 7, Via XXIV Maggio, Borgo Valsugana, Comunit&agrave, Valsugana e Tesino, TN, Trentino-Alto Adige, 38051, ",,,Tutti,"Intero Euro 7,00 - Ridotto Euro 5,00 - Abbonamento 10 film a scelta (escluso ""Piacere del cinema"") Euro 60,00",,,,Cinema,,,,,,0461 754052,,,https://www.facebook.com/cineteatro.borgo/|Facebook,,interno,,,0.0,,,
0851fbdd7c4b9f18f35b268b5a3eb301,2018-04-21T21:30:00+02:00,2018-03-06T13:33:47+01:00,Visita guidata all'osservatorio astronomico del Celado,,/var/comunitavalsugana/storage/images/applicazioni5/openagenda/eventi/visita-guidata-all-osservatorio-astronomico-del-celado2/3088485-1-ita-IT/Visita-guidata-all-osservatorio-astronomico-del-Celado.jpg,Serata dedicata alla visita dell'Osservatorio Astronomico del Celado,"
Serata dedicata alla visita dell'Osservatorio Astronomico del Celado con presentazione della struttura, osservazione telescopica e proiezione di filmati. Si osserveranno i corpi celesti più spettacolari che si renderanno visibili (luna e pianeti, ammassi stellari aperti e globulari, nebulose, galassie).Inoltre si parlerà di moti apparenti e reali del Sole, della Terra e dei pianeti, il tempo e le stagioni, il Sistema Solare, le stelle, la via Lattea, altre Galassie, l'Universo.",,2018-04-21T21:30:00+02:00,2018-04-21T23:30:00+02:00,Dalle 21.30 alle 23.30,,Il 21aprile 2018,"Osservatorio astronomico del Celado, Castello Tesino",46.039797,11.651681,"Celado, Castello Tesino, Comunit&agrave, Valsugana e Tesino, TN, Trentino-Alto Adige, 38053, Italia","
IMPORTO DELL'ATTIVITÀ:
Euro 5,00 a persona
Euro 3,00 bambini/ragazzi in età scolareGratis per bambini fino ai 5 anni
NOTE:
- iscrizioni entro le ore 12.00 del giorno precedente la visita,
- in caso di tempo nuvoloso la visita si limiterà alla visione di filmati e argomentazioni in aula nonché alla visita della struttura
- su richiesta per gruppi l'attività potrà essere svolta in lingua inglese - ritrovo presso Osservatorio Astronomico - Altipiano di Celado (km 7,8 da Castello Tesino)",,Tutti,5 Euro,,,,Visita guidata,Visite guidate all osservatorio,,,,,Info e prenotazione obbligatoria: 0461 593322 - 0461 727730,,castellotesino@visitvalsugana.it,,,interno,,,0.0,,,
4548e849c68d6831e4ca133c687e6f8f,2018-04-21T17:00:00+02:00,2018-04-14T11:45:10+02:00,Mostra fotografica con materiale inedito di don Gianni Chemini,,/var/comunitavalsugana/storage/images/applicazioni5/openagenda/eventi/mostra-fotografica-con-materiale-inedito-di-don-gianni-chemini/3103051-1-ita-IT/Mostra-fotografica-con-materiale-inedito-di-don-Gianni-Chemini.jpg,"Comunità M.A.S.C.I. di Strigno, in occasione dl 20mo di fondazione e del 70mo di fondazione del Gruppo Scout Borgo I° organizza la Mostra fotografica con materiale inedito di don Gianni Chemini",Inaugurazione sabato 21 aprile alle 17.00,http://www.comunitavalsuganaetesino.it/content/download/211847/3103054/1/2838_A5.pdf,2018-04-21T17:00:00+02:00,2018-05-01T21:00:00+02:00,A partire dalle 17,,Dal 21 aprile al primo maggio 2018,"Biblioteca comunale Albano Tomaselli, Castel Ivano (Strigno), piano terra",46.065864,11.522042,"Biblioteca comunale, Piazzetta Luigi Carbonari, Ivano, Pellegrini, Castel Ivano, Comunit&agrave, Valsugana e Tesino, TN, Trentino-Alto Adige, 38059, I","
Orari di apertura:
feriale dalle 17.00 alle 21.00
festivo dalle 10.00 alle 13.00 e dalle 15.00 alle 21.00Con il patrocinio del Comune di Castel Ivano e della Cassa Rurale Valsugana e Tesino",,Tutti,Ingresso libero,,,,"Mostra,Mostra fotografica",,Comune di Castel Ivano,,,,,,,,,interno,,,0.0,,,
5bfd5ea5dceea9d5547f4038abfa7bbb,2018-04-21T11:00:00+02:00,2018-04-03T13:53:22+02:00,Giordani/Valle Guitar duo,,/var/comunitavalsugana/storage/images/applicazioni5/openagenda/eventi/giordani-valle-guitar-duo/3099150-1-ita-IT/Giordani-Valle-Guitar-duo.jpg,"Concerto di jazz acustico per la rassegna &quot,Quando l'acqua incontra la musica&quot, organizzato da Rari Nantes Valsugana",,,2018-04-21T11:00:00+02:00,2018-04-21T13:00:00+02:00,Alle 11,,Il 21 aprile 2018,"Piscina comunità di valle, Borgo Valsugana",46.050324,11.467581,"Via Piccola, Crosetta, Olle, Borgo Valsugana, Comunit&agrave, Valsugana e Tesino, TN, Trentino-Alto Adige, 38051, Italia","
Piscina comunità di valle Borgo Valsugana
Evento gratuito, consumazioni escluseIn caso di pioggia o condizioni atosferiche avverse i concerti non verranno posticipati",,Tutti,"Evento gratuito, consumazioni escluse",,,,"Musica,Concerto jazz",,,,,,,,,,,esterno,,,0.0,,,
6b6c1d919e1b2ab3201c6b039fb8704d,2018-04-21T09:00:00+02:00,2018-04-30T19:40:27+02:00,Haru No Budo: Primavera del Budo nel Tesino,,/var/comunitavalsugana/storage/images/applicazioni5/openagenda/eventi/haru-no-budo-primavera-del-budo-nel-tesino/3098509-4-ita-IT/Haru-No-Budo-Primavera-del-Budo-nel-Tesino.jpg,Stage Culturale di Arti Marziali,"Stage Culturale di Arti Marziali: Karate, Ju-jutsu, Judo, Aikido, Panatukan, TCS, Krav Maga, SDS, Tai Chi, Qwan Ki Do, Viet Vo Dao, Ryu Kyu Kempo, Taekwondo, Bojutsu, Kiai Do, Iai Do",http://www.comunitavalsuganaetesino.it/content/download/211469/3098512/4/locandina primavera budo2018.jpg,2018-04-21T09:00:00+02:00,2018-04-22T13:00:00+02:00,Il giorno 21 dalle 9:00 alle 13:00 e dalle 15:00 alle 19:00. Il giorno 22 dalle 9:00 alle 13:00.,,I giorni 21 e 22 aprile 2018,Pieve Tesino. Centro Polifunzionale,46.067984,11.60602,"Via Gilberto Buffa, Maso dei Caffi, Pieve Tesino, Comunit&agrave, Valsugana e Tesino, TN, Trentino-Alto Adige, 38053, Italia",,,Tutti,,,,,"Altro,Manifestazioni ed eventi",,A.S.D. Accademia Fudoushin,,,"Foto di gruppo Cinte
foto insegnanti Cinte
Foto di gruppo Cinte (1)",3487462767,,mario.fudoushin@gmail.com,,,interno,,,0.0,,,
d45f6e25d80aa6ee58fa27e628743849,2018-04-21T09:00:00+02:00,2018-04-16T12:40:43+02:00,Sagra di San Giorgio,,/var/comunitavalsugana/storage/images/applicazioni5/openagenda/eventi/sagra-di-san-giorgio/3103444-2-ita-IT/Sagra-di-San-Giorgio.jpg,Sagra di San Giorgio - Castello Tesino. Numerosissimi eventi per una due giorni all'insegna del divertimento. ,"Sagra di San Giorgio. 21 e 22 aprile 2018. Grandi eventi per festeggiare il Santo Patrono.Sabato 21 aprile 2018.dalle ore 9 alle ore 13: scivolo gonfiabile in loc. San Rocco,ore 15,30: merenda per tutti i bambini in casa di riposo, ore 16: scenetta, ore 16,30 canti e tombola,dalle ore 17: stand gastronomici nei giardini di via Dante,dalle ore 21: musica cover-rock nei giardini di via Dante.Domenica 22 aprile 2018:dalle ore 8: grande fiera in via Dante,dalle ore 9 alle ore 14: gioco gonfiabile nei giardini di via Dante,dalle ore 10: stande gastronomici giardini via Dante,ore 10,30: Santa Messa e processione,ore 11,45: balli e musica con il gruppo folk e banda folk, vie del paese,ore 15: giochi per piccoli pompieri in piazza Marconi,ore 17,30: film &quot,Belle e Sebastien, amici per sempre&quot, al cinema.",http://www.comunitavalsuganaetesino.it/content/download/211868/3103447/3/2879.pdf,2018-04-21T09:00:00+02:00,2018-04-22T20:00:00+02:00,Dalle ore 9 di sabato 21 aprile alle ore 20 di domenica 22 aprile 2018,,Dal 21 al 22 aprile 2018,Castello Tesino,46.06336,11.633234,"parcheggio Biblioteca comunale, Via Venezia, Castello Tesino, Comunit&agrave, Valsugana e Tesino, TN, Trentino-Alto Adige, 38053, Italia","Biblioteca Comunale Castello Tesino, 0461-593232",,Tutti,"Nessun costo, ad eccezione del film.",,,,"Cinema,Manifestazioni ed eventi,Musica,Incontri e convegni,Festa,Enogastronomia",,ASSOCIAZIONE PER LA COMUNICAZIONE SOCIALE - CASTELLO TESINO,,,,0461-593232,,,,,interno,,,0.0,,,
40bd1df665bb25e5f40063b0a1a46d39,2018-04-20T20:30:00+02:00,2018-04-11T09:13:51+02:00,Adesso o mai più,,/var/comunitavalsugana/storage/images/applicazioni5/openagenda/eventi/adesso-o-mai-piu3/3101802-1-ita-IT/Adesso-o-mai-piu.jpg,Interventi concreti per la tua abitazione e il tuo territorio,Serata pubblica di presentazione delle nuove opportunità relative ai contributi per la ristrutturazione e acquisto casa. Interverrà l'assessore provinciale Carlo Daldoss.,,2018-04-20T20:30:00+02:00,2018-04-20T22:30:00+02:00,Alle 20.30,,Il 20 aprile 2018,"Palazzo Gallo, Castello Tesino",46.064465,11.632401,"Palazzo Gallo, Via Cesare Battisti, Castello Tesino, Comunit&agrave, Valsugana e Tesino, TN, Trentino-Alto Adige, 38053, Italia",,,Tutti,Ingresso libero,,,,"Incontri e convegni,Convegno",Adesso o mai più,,,,,,,,,,interno,,,0.0,,,
e9ddb8ade89bfa4a7f9cf9ceebc7fce7,2018-04-20T18:00:00+02:00,2018-04-11T09:11:47+02:00,Adesso o mai più,,/var/comunitavalsugana/storage/images/applicazioni5/openagenda/eventi/adesso-o-mai-piu2/3101730-1-ita-IT/Adesso-o-mai-piu.jpg,Interventi concreti per la tua abitazione e il tuo territorio,Serata pubblica di presentazione delle nuove opportunità relative ai contributi per la ristrutturazione e acquisto casa. Interverrà l'assessore provinciale Carlo Daldoss.,,2018-04-20T18:00:00+02:00,2018-04-20T20:00:00+02:00,Alle 18,,Il 20 aprile 2018,Sala della Cassa rurale - Via Vittorio Emanuele 144 - Grigno,46.017292,11.635229,"Via Vittorio Emanuele, Grigno, Comunit&agrave, Valsugana e Tesino, TN, Trentino-Alto Adige, 38053, Italia",,,Tutti,Ingresso libero,,,,"Incontri e convegni,Convegno",Adesso o mai più,,,,,,,,,,interno,,,0.0,,,
