e57d22d185664ba394ff49761ed90d87,2019-11-23T20:30:00+01:00,2019-11-07T16:20:23+01:00,Il grido delle donne nella Grande guerra,,/var/comunitavalsugana/storage/images/applicazioni5/openagenda/eventi/il-grido-delle-donne-nella-grande-guerra/3199577-3-ita-IT/Il-grido-delle-donne-nella-Grande-guerra.jpg,"Recital di Luigi Sardi, giornalista e storico con Antonella Dalpiaz, voce narrante e Piergiorgio Lunelli, accompagnamento musicale.","Il recital racconta la rivolta del 15 aprile 1915 delle “popolane” di Trento che si radunarono in Via Belenzani al grido di pane e pace nella prima manifestazione pacifista nell’Europa ormai in fiamme, vicenda presa dagli articoli di Alcide Degasperi scritti per le pagine del giornale Il Trentino. Lo spettacolo intende trattare della guerra vista e sofferta dal mondo femminile, fino ad ora mai raccontata, presa dagli articoli dei giornali dell’epoca e dai diari scritti da mano femminile cento anni fa.",https://www.comunitavalsuganaetesino.it/content/download/223970/3199580/4/Locandina_A3.pdf,2019-11-23T20:30:00+01:00,2019-11-23T23:00:00+01:00,dalle 20.30,,sabato 23 novembre 2019,Comunità Valsugana e Tesino - Piazzetta Ceschi n. 1 - Borgo Valsugana (TN),46.054722,11.460197,"Piazzetta Ceschi, Crosetta, Cimond&egrave,, Borgo Valsugana, Comunit&agrave, Valsugana e Tesino, Trento, Trentino-Alto Adige, Italia",,,Tutti,ingresso libero,,,,Teatro,,Comunità Valsugana e Tesino,,,,0461/755512,,segreteria@comunitavalsuganaetesino.it,,,interno,,,0.0,,,
3076697794eac8a4dafacc51f1cc4a43,2019-11-15T20:00:00+01:00,2019-11-07T15:46:07+01:00,LUCI NELL'OSCURITA',,/var/comunitavalsugana/storage/images/applicazioni5/openagenda/eventi/luci-nell-oscurita/3199501-1-ita-IT/LUCI-NELL-OSCURITA.jpg,Mostra fotografica,"Il Gruppo Grotte Selva si racconta attraverso immagini del mondo sotterraneo in una mostra fotografica dal titolo &quot,Luci nell'oscurità&quot, che si terrà presso l'Antica Pieve dei SS. Giacomo e Cristoforo di Grigno (TN) dal 16 al 30 novembre 2019.Inaugurazione sabato 15 novembre 2019 alle ore 20.00.Orario mostra:dal martedì al sabato 10.00-12.00 e 15.00-18.00domenica 10.00-12.00lunedì CHIUSOIngresso libero",https://www.comunitavalsuganaetesino.it/content/download/223968/3199504/1/mostra-fotografica-GGS.jpg,2019-11-15T20:00:00+01:00,2019-11-30T20:00:00+01:00,"dal martedì al sabato 10.00-12.00 e 15.00-18.00, domenica 10.00-12.00, lunedì chiuso",,dal 15 al 30 novembre 2019,Antica Pieve dei SS. Giacomo e Giovanni,46.017035,11.635941,"Grigno, Comunit&agrave, Valsugana e Tesino, Trento, Trentino-Alto Adige, 38055, Italia",,,Tutti,gratuito,,,,Mostra,,Biblioteca comunale O. Gasperini di Grigno (TN),,,,0461/765414,,grigno@biblio.infotn.it,http://www.comunegrigno.it,,interno,,,0.0,,,
52830d9e495ef5647a6b52e89347c840,2019-11-13T16:30:00+01:00,2019-11-08T18:06:27+01:00,SOGNANDO LA LUNA. Letture e laboratorio per bambini ,,/var/comunitavalsugana/storage/images/applicazioni5/openagenda/eventi/sognando-la-luna.-letture-e-laboratorio-per-bambini/3199846-1-ita-IT/SOGNANDO-LA-LUNA.-Letture-e-laboratorio-per-bambini.png,"La Biblioteca di Telve invita tutti i bambini mercoledì 13 novembre 2019 ore 16.30alle letture e laboratorio &quot,SOGNANDO LA LUNA&quot,",,https://www.comunitavalsuganaetesino.it/content/download/223991/3199849/1/voglio la luna laboratorio 1.jpg,2019-11-13T16:30:00+01:00,2019-11-13T18:00:00+01:00,dalle 16.30 all 18.00,,13 novembre 2019,Biblioteca di Telve,46.071029,11.479236,"Piazzale Depero, 2",,,Bambini,,,,,Laboratorio,,Biblioteca comunale di Telve,,,,0461766714,,telve@biblio.infotn.it,,,interno,,,0.0,,,
8d357ae314325a7054a995973651de06,2019-11-08T20:00:00+01:00,2019-07-19T12:09:45+02:00,Caregiver familiari: promotori di benessere e salute.,,/var/comunitavalsugana/storage/images/applicazioni5/openagenda/eventi/caregiver-familiari-promotori-di-benessere-e-salute2/3182398-1-ita-IT/Caregiver-familiari-promotori-di-benessere-e-salute.jpg,"Due serate di informazione e sensibilizzazione rivolte a chi si prende cura di un proprio caro non autosufficiente, due momenti per approfondire il tema delle esigenze emergenti rispetto all’invecchiamento della popolazione ed il ruolo del caregiver familiare.",,https://www.comunitavalsuganaetesino.it/content/download/221846/3182401/2/loc_SOLOfile_CURAINSIEME_GIUGNO19_valsugana tesino-01.jpg,2019-11-08T20:00:00+01:00,2019-11-15T23:00:00+01:00,dalle ore 20.00,,venerdì 8 e venerdì 15 novembre 2019,Palazzo Gallo - Castello Tesino (TN),46.064175,11.632171,"Castello Tesino, Comunit&agrave, Valsugana e Tesino, TN, Trentino-Alto Adige, 38053, Italia",,,Tutti,,,,,"Manifestazioni ed eventi,Incontri e convegni",,Comunità Valsugana e Tesino,,,,,,,,,interno,,,0.0,,,
17343977feedd8150bb6564ab67bc756,2019-11-07T20:30:00+01:00,2019-10-30T09:32:58+01:00,MONTANARI SI DIVENTA. Presentazione del libro di Ezio Amistadi,,/var/comunitavalsugana/storage/images/applicazioni5/openagenda/eventi/montanari-si-diventa.-presentazione-del-libro-di-ezio-amistadi/3198214-1-ita-IT/MONTANARI-SI-DIVENTA.-Presentazione-del-libro-di-Ezio-Amistadi.jpg,"Presentazione del libro &quot,Montanari si diventa&quot, con l'autore Ezio Amistadi",,https://www.comunitavalsuganaetesino.it/content/download/223795/3198217/1/montanari si diventa_Layout 1.jpg,2019-11-07T20:30:00+01:00,2019-11-07T22:00:00+01:00,dalle 20.30 alle 22.00,,7 novembre 2019,Biblioteca di Telve,46.071029,11.479236,"Piazzale Depero, 2",,,Tutti,,,,,Presentazione libro,,Biblioteca comunale di Telve,,,,0461766714,,telve@biblio.infotn.it,,,interno,,,0.0,,,
022578fa4b3a9f3a429963d7b7e71614,2019-10-30T16:30:00+01:00,2019-10-08T16:39:19+02:00,Aspettando Halloween...,,/var/comunitavalsugana/storage/images/applicazioni5/openagenda/eventi/aspettando-halloween/3194776-1-ita-IT/Aspettando-Halloween.jpg,La Biblioteca di Telve invita i bambini dai 4 anni in su al laboratorio ”Rifugio per i pipistrelli”," “Costruendo un rifugio per loro, i bambini prenderanno consapevolezza del ruolo fondamentale che questi “amici” svolgono quotidianamente sul nostro pianeta proteggendo l’ecosistema e la biodiversità. Impareranno a rispettarli, conoscerli e proteggerli. “mercoledì 30 ottobre 2019 dalle ore 16.30 - l’iscrizione è obbligatoria - quota di partecipazione euro 12",https://www.comunitavalsuganaetesino.it/content/download/223315/3194779/1/RIFUGIO PIPISTRELLI 1.jpg,2019-10-30T16:30:00+01:00,2019-10-30T18:30:00+01:00,dalle 16.30 alle 18.30,,mercoledì 30 ottobre 2019,biblioteca di telve,46.071029,11.479236,"Piazzale Depero, 2",,,Bambini,€ 12,,,,Laboratorio,,Biblioteca comunale di Telve,,,,0461766714,,telve@biblio.infotn.it,,,interno,,,0.0,,,
cc86eb086e360fe5fa738ef8415925b5,2020-09-06T09:00:00+02:00,2020-09-01T08:19:19+02:00,"Gara Giovanile U14 - Circuito ""Saranno Famosi""",,/var/comunitavalsugana/storage/images/applicazioni5/openagenda/eventi/gara-giovanile-u14-circuito-saranno-famosi/3239450-1-ita-IT/Gara-Giovanile-U14-Circuito-Saranno-Famosi.jpg,"Gara Individuale U14 su 2 giri , 18 buche, Par 68 e Caccia all'Handicap 9 Buche","Per Domenica 6 Settembre organizziamo sul nuovo percorso a 9 buche Gara 18 BUCHE Stableford U14 2 giri, par 68.Nella stessa giornata viene organizzata gara caccia all'Handicap su 9 buche.La Direzione","https://www.comunitavalsuganaetesino.it/content/download/230690/3239453/3/gara giovanile 6sett2020 1-1,9.pdf",2020-09-06T09:00:00+02:00,2020-09-06T18:00:00+02:00,Dalle ore 9.00 alle ore 18.00,,Domenica 6 Settembre 2020,Golf Club Roncegno,46.047086,11.423792,"Golf Club Roncegno - Valsugana Golf, Via Ferme, Maso Vazzena, Masetti, Roncegno Terme, Comunit&agrave, Valsugana e Tesino, Provincia di Trento, Trenti","Si prega, per motivi organizzativi, di voler confermare la presenza alla gara, entro Mercoledì 2 Settembre alle ore 24:00, facendo l'iscrizione on-line direttamente sul sito del circolo o inviando mail alla segreteria del circolo.",,Giovani,,,,,Golf,,Golf Club Roncegno Valsugana,,,,0461/773337,,info@golfclubroncegno.it,,,esterno,,,0.0,,,
c2ab27dd1e92d77711610cbe5e273cea,2020-07-01T08:00:00+02:00,2020-06-20T15:21:50+02:00,Sulle vicende agricole della Valsugana,,/var/comunitavalsugana/storage/images/applicazioni5/openagenda/eventi/sulle-vicende-agricole-della-valsugana/3228934-1-ita-IT/Sulle-vicende-agricole-della-Valsugana.jpg,Mostra fotografica all'aperto,"“Sulle vicende agricole della Valsugana” è il titolo della mostra fotografica all’aperto che inaugura il ritorno alla piena operatività dell’Ecomuseo della Valsugana dopo l’emergenza coronavirus. “Tante iniziative sono purtroppo rimandate all’anno prossimo, come per esempio Pietre d’acqua, il simposio di scultura su granito lungo le sponde del torrente Chieppena”, spiega il presidente Andrea Tomaselli, “ma già da qualche anno stiamo esplorando nuove modalità espositive all’aperto con ottimi risultati e questa esperienza torna utile oggi”.La nuova mostra, che prende il via mercoledì primo luglio e sarà visitabile fino a fine settembre, si snoda lungo i suggestivi percorsi pedonali del parco fluviale di Bieno, è stata curata da Irene Fratton e si basa sull’omonimo volume di Franco Gioppi, pubblicato nel 2018 dall’Associazione agraria di Borgo Valsugana.Trenta grandi pannelli in bianco e nero documentano le attività agricole in Valsugana nella prima metà del Novecento, prima della meccanizzazione di un comparto produttivo da sempre fondamentale per l’economia della valle.Attraverso le splendide immagini di Gigi Cerbaro e alla puntigliosa documentazione fotografica di don Cesare Refatti, tra gli altri, ecco allora scorrere piccoli frammenti di un mondo solo in parte perduto, lento e compassato, rispettoso dei tempi della natura e delle stagioni: il pascolo, la fienagione, la cura del bestiame, il lavoro in malga, la raccolta della legna, la cura del bosco, l’apicoltura, la realizzazione di attrezzi, la lavorazione delle materie prime. Quasi un invito a rinsaldare un legame stretto con il territorio che viviamo e a riconquistarci un piccolo frammento di qualità del nostro tempo, senza stucchevoli nostalgie del passato ma con una ritrovata consapevolezza da restituire a un presente da vivere nel segno della sostenibilità.",https://www.comunitavalsuganaetesino.it/content/download/228758/3228937/1/locandina.pdf,2020-07-01T08:00:00+02:00,2020-09-30T22:00:00+02:00,Tutto il giorno,,Dall'1 luglio al 30 settembre,"Bieno, parco fluviale",46.080241,11.558712,"1, Via Brogio, Lusumina, Casetta, Bieno, Comunit&agrave, Valsugana e Tesino, Provincia di Trento, Trentino-Alto Adige, 38050, Italia",,,Tutti,Ingresso libero,,,,"Mostra,Mostra fotografica",,Ecomuseo della Valsugana - Dalle sorgenti di Rava al Brenta,,,,,,,,,esterno,,,0.0,,,
a9dd48edc997322f6722798c3aada182,2021-02-12T20:30:00+01:00,2021-05-18T10:35:55+02:00,SERATA DIVULGATIVA ON-LINE SUI METODI NATURALI PER  AUMENTARE LE DIFESE IMMUNITARIE,,/var/comunitavalsugana/storage/images/applicazioni5/openagenda/eventi/serata-divulgativa-on-line-sui-metodi-naturali-per-aumentare-le-difese-immunitarie/3260601-1-ita-IT/SERATA-DIVULGATIVA-ON-LINE-SUI-METODI-NATURALI-PER-AUMENTARE-LE-DIFESE-IMMUNITARIE.png,"LA BIBLIOTECA DI TELVE INVITA LA POPOLAZIONE AD UNA SERATA DIVULGATIVA ON-LINE DAL TITOLOI METODI NATURALI PER AUMENTARE LE DIFESE IMMUNITARIErelatore: Annalisa Frontini, naturopataVENERDI’ 12 FEBBRAIO 2021 ORE 20:30 SERATA ON-LINE SULLA PIATTAFORMA ZOOMPer collegarsi è necessario scaricare la App di Zoom e cliccare il link:https://us02web.zoom.us/j/81894015033  ",,https://www.comunitavalsuganaetesino.it/content/download/234462/3260604/1/NATUROPATIA.jpg,2021-02-12T20:30:00+01:00,2021-02-12T22:00:00+01:00,dalle 20.30 alle 22.00 circa,,venerdì 12 febbraio 2021,on line https://us02web.zoom.us/j/81894015033,46.07105,11.47942,"Piazzale Depero, Nale, Longhini, Telve, Comunit&agrave, Valsugana e Tesino, Provincia di Trento, Trentino-Alto Adige, 38050, Italia",SERATA ON-LINE SULLA PIATTAFORMA ZOOMPer collegarsi è necessario scaricare la App di Zoom e cliccare il link:https://us02web.zoom.us/j/81894015033  ,,Tutti,,,,,Incontri e convegni,,Biblioteca comunale di Telve,,,,0461766714,,telve@biblio.tn.it,,,interno,,,0.0,,,
7f71ed10e24b56175e698819f654b039,2021-07-09T20:30:00+02:00,2021-07-20T10:12:17+02:00,CONCERTO D'ESTATE,,/var/comunitavalsugana/storage/images/applicazioni5/openagenda/eventi/concerto-d-estate/3285353-1-ita-IT/CONCERTO-D-ESTATE.jpg,Concerto del Coro HIGHLIGHT di Pergine Valsugana,Venerdì 9 luglio - ore 20.30 - Piazzale Depero - Prenotazione telefonica obbligatoria 0461766714,https://www.comunitavalsuganaetesino.it/content/download/239185/3285356/1/Musical Theatre Choir RID.jpg,2021-07-09T20:30:00+02:00,2021-07-09T22:00:00+02:00,dalle 20.30 alle 22.00 circa,,9 luglio 2021,piazzale della Biblioteca,46.07105,11.47942,Piazzale Depero - Telve,,,Tutti,gratuito,,,,Concerto corale,,Biblioteca comunale di Telve,,,,0461766714,,telve@biblio.tn.it,,,esterno,,,0.0,,,
c80075c8cd3e1092866256fa10780bf6,2017-06-24T09:30:00+02:00,2017-05-20T12:03:15+02:00,Il giardino delle meraviglie: sabati del bambino,,/var/comunitavalsugana/storage/images/applicazioni5/openagenda/eventi/il-giardino-delle-meraviglie-sabati-del-bambino7/3048736-1-ita-IT/Il-giardino-delle-meraviglie-sabati-del-bambino.jpg,Uno spazio dove potete lasciare giocare i vostri bambini (dai 0 ai 13 anni) mentre voi potrete fare acquisti nei negozi del centro.,,,2017-06-24T09:30:00+02:00,2017-06-24T19:00:00+02:00,Dalle 9.30 alle 12.30 e dalle 15.30 alle 19.00,,,Piazzetta Ceschi - Borgo Valsugana,46.054643,11.460012,Piazzetta Ceschi - Borgo Valsugana,,,Bambini,,,,,Festa,Il giardino delle meraviglie: sabati del bambino,,,,,,,,https://www.facebook.com/visitborgovalsugana|visitborgovalsugana,,esterno,,,0.0,,,Comune di Borgo Valsugana
bc00fdecdae7e76821cd1362591673ac,2017-06-23T20:30:00+02:00,2017-06-20T10:16:49+02:00,Famiglia all'improvviso. Istruzioni non incluse,,/var/comunitavalsugana/storage/images/applicazioni5/openagenda/eventi/famiglia-all-improvviso.-istruzioni-non-incluse/3054721-1-ita-IT/Famiglia-all-improvviso.-Istruzioni-non-incluse.jpg,"
Il film campione di incassi che sta emozionando e divertendo il mondo, con il protagonista di “Quasi amici” Omar Sy. Samuel vive la sua vita nel Sud della Francia senza responsabilità e senza legami importanti fino a quando una delle sue vecchie fiamme gli lascia tra le braccia una bambina di pochi mesi, Gloria: sua figlia!Inizialmente incapace di prendersene cura, Samuel impara giorno dopo giorno ad essere un buon padre. Otto anni dopo, quando Samuel e la piccola Gloria sono ormai inseparabili e felici, una sorpresa inaspettata cambierà le loro vite...",,,2017-06-23T20:30:00+02:00,2017-06-23T22:30:00+02:00,,,,Cinema Teatro del Centro scolastico - Borgo Valsugana,46.053897,11.461024,Cinema Teatro del Centro scolastico - Borgo Valsugana,,,Famiglia,"Intero 7,00 Euro, ridotto 5 Euro",,,,Cinema,,,,,,,,,,,interno,,,0.0,,,Comune di Borgo Valsugana
e2932fbe866c8baa71b0481d97ffa5c5,2017-06-18T16:00:00+02:00,2017-05-19T11:26:50+02:00,"Fucina verde ArteSella: ""Cantico dei cantici""",,/var/comunitavalsugana/storage/images/applicazioni5/openagenda/eventi/fucina-verde-artesella-cantico-dei-cantici/3047752-1-ita-IT/Fucina-verde-ArteSella-Cantico-dei-cantici.jpg,"Fucina verde ArteSella propone il &quot,Cantico dei cantici&quot,, con Coro del Friuli, Blow Up Percussion, Mario Brunello - violoncello e con Padre Enzo Bianchi.","Programma:Sofija Asgatovna Gubajdulina, The Canticle of the Sun of St. Francis of Assisi (1997)",,2017-06-18T16:00:00+02:00,2017-06-18T18:00:00+02:00,,,,Malga Costa - Borgo Valsugana,46.009118,11.370606,Malga Costa - Borgo Valsugana,"
Prenotazione obbligatoria chiamando il numero 0461 751251 dal lunedì al venerdì, dalle 8 alle 12 e il giorno dell’evento.Lo spettacolo è garantito anche in caso di maltempo, fino a esaurimento posti e verrà effettuato presso la Chiesa Arcipretale di Borgo Valsugana alle ore 16.",,Tutti,"Ingresso Euro 25,00",,,,Musica,ArteSella 2017,,,,,0461 751251,,comunicazione@artesella.it,http://www.artesella.it|www.artesella.it,,esterno,,,0.0,,,Comune di Borgo Valsugana
4fa358a62be717eea67119def715ab7d,2017-06-18T09:15:00+02:00,2017-05-17T11:15:33+02:00,Gusto di vivere il Lagorai,,/var/comunitavalsugana/storage/images/applicazioni5/openagenda/eventi/gusto-di-vivere-il-lagorai6/3046867-1-ita-IT/Gusto-di-vivere-il-Lagorai.jpg,"A partire da domenica 21 maggio 2017 e fino all'1 ottobre le visite guidate &quot,Gusto di vivere il Lagorai&quot,: un'uscita sul territorio del Comune di Castel Ivano insieme con gli accompagnatori di media montagna.","
&quot,Gusto di vivere il Lagorai&quot, accompagnerà ospiti e residenti alla riscoperta di alcuni fra i più preziosi scorci del Comune di Castel Ivano. Si parte dal Centro Sportivo di Agnedo per proseguire lungo l'argine del torrente Chieppena e arrivare alla sede del simposio di scultura su granito &quot,Pietre d'Acqua&quot,. A qualche centinaio di metri sarà possibile visitare l'Oasi Faunistica di Castel Ivano e salire quindi la collina che porta all'antico maniero, dove è prevista la degustazione dei prodotti tipici locali. L'uscita prosegue poi in direzione di Agnedo lungo la &quot,via Erta&quot,, con tappe all'antica &quot,fusina&quot, Zanghellini e ad alcune testimonianze della grande guerra, per concludersi nuovamente al Centro Sportivo.Le passeggiate si svolgeranno tutte le domeniche a partire dal 21 maggio fino al 1 ottobre. L'orario di partenza è fissato per le 9.15 presso il Centro Sportivo. Per ulteriori informazioni e per eventuali prenotazioni rivolgersi presso l'azienda per il Turismo Valsugana Lagorai – Terme – Laghi al numero 0461 727700.",http://www.comunitavalsuganaetesino.it/content/download/205593/3046870/3/Flyer_210x148mm_Oasi_3.pdf,2017-06-18T09:15:00+02:00,2017-06-18T12:30:00+02:00,Dalle 9.15 alle 12.30,,Dal 21 maggio all'1 ottobre 2017,Centro sportivo di Agnedo - Castel Ivano,46.052922,11.52292,,"Durata: 3 ore di cammino, comprese soste nei punti di interesse e degustazioneRitrovo: 9.15 presso Centro di Alpinismo LagoraiTermine: 12.30Tipologia utente: attività per tutti, bambini e adulti (minimo 1 partecipante, massimo 25)Costo: 12,00 € inclusa la quota accompagnatore media montagna e degustazione, 2,00 € per i bambini under 12Difficoltà: percorso facile in parte su sentiero, brevi tratti in salita,Consigliate calzature idonee per percorrere un sentiero a tratti un po’ sconnesso
PARCO ACCESSIBILE GRATUITAMENTEPARCHEGGIO PARCO PUBBLICO E AREA LIMITROFA AL CASTELLO",,Famiglia,"12,00 € inclusa la quota accompagnatore media montagna e degustazione, 2,00 € per i bambini under 12",,,,"Enogastronomia,Escursione,Visita guidata",,,,,,0461 727700,,gabriele.tisi@gmail.com,http://www.visitvalsugana.it/it/|Visitvalsugana,,esterno,,,0.0,,,Comune di Castel Ivano
477fa211479d1f9db2262a351479588a,2017-06-17T09:30:00+02:00,2017-05-20T12:01:17+02:00,Il giardino delle meraviglie: sabati del bambino,,/var/comunitavalsugana/storage/images/applicazioni5/openagenda/eventi/il-giardino-delle-meraviglie-sabati-del-bambino6/3048698-1-ita-IT/Il-giardino-delle-meraviglie-sabati-del-bambino.jpg,Uno spazio dove potete lasciare giocare i vostri bambini (dai 0 ai 13 anni) mentre voi potrete fare acquisti nei negozi del centro.,,,2017-06-17T09:30:00+02:00,2017-06-17T19:00:00+02:00,Dalle 9.30 alle 12.30 e dalle 15.30 alle 19.00,,,Piazza Degasperi - Borgo Valsugana,46.053234,11.4564,Piazza Degasperi - Borgo Valsugana,,,Bambini,,,,,Festa,Il giardino delle meraviglie: sabati del bambino,,,,,,,,https://www.facebook.com/visitborgovalsugana|visitborgovalsugana,,esterno,,,0.0,,,Comune di Borgo Valsugana
61454696fb0f010444a93fe1d187da66,2017-06-15T18:00:00+02:00,2017-05-27T11:26:14+02:00,Paolo Amarisse Drums Trio,"Musica classica, jazz e d'autore",/var/comunitavalsugana/storage/images/applicazioni5/openagenda/eventi/musica-classica-jazz-e-d-autore/3050055-1-ita-IT/Musica-classica-jazz-e-d-autore.jpg,"
Standard jazzBatteria, chitarra, basso",,,2017-06-15T18:00:00+02:00,2017-06-15T20:00:00+02:00,,,,Piscina comunale di Roncegno Terme,46.04875,11.40792,"Via del Parco, 7 - Roncegno Terme","
Aperitivo con degustazione vini e buffetIn caso di maltempo l'evento non verrà annullato",,,,,,,Musica,Quando l'acqua incontra la musica,,,,,0461700373 dalle 7 alle 23 - 3208490893 24/24,,giusyl@teletu.it,https://www.rarinantesvalsugana.com/|www.rarinantesvalsugana.com,,esterno,,,0.0,,,Comune di Roncegno Terme
8f572617b18a62108d04ce8cbc4fb5ac,2017-06-11T09:30:00+02:00,2017-05-16T14:50:08+02:00,A 100 anni dalla battaglia dell'Ortigara,,/var/comunitavalsugana/storage/images/applicazioni5/openagenda/eventi/a-100-anni-dalla-battaglia-dell-ortigara3/3046136-1-ita-IT/A-100-anni-dalla-battaglia-dell-Ortigara.jpg,Il 10 e 11 giugno ricordiamo una fra le più sanguinose battaglie sul fronte austo-italiano durante la prima guerra mondiale.,"Si propone una pacata riflessione sugli accadimenti bellici che 100 anni fa sconvolsero per atrocità e numero di caduti le nostre montagne. Una delle più sanguinose battaglie svoltesi sul fronte Austro-Italiano durante la prima guerra Mondiale.PROGRAMMA DELLA COMMEMORAZIONESABATO 10 GIUGNO 2017 - BORGO VALSUGANA
ore 18.45in Piazza Alcide Degasperi, presentazione dell’evento, a seguire, concerto della Banda Civica di Borgo Valsugana,
ore 19.30presso il Chiostro del Municipio, inaugurazione della Mostra &quot,... in 1000 non tornarono&quot,, a seguire, relazione storico-culturale a cura del Dott. Luca Girotto, Concerto a tema del Coro Val Bronzale di Ospedaletto
DOMENICA 11 GIUGNO 2017
CASTELNUOVO - LOCALITÀ CIVERONECerimonia di commemorazione della Battaglia dell’Ortigara
ore 9.30Ritrovo dei partecipanti
ore 9.45Introduzione alla giornata e intermezzo bandistico
ore 10.00Santa Messa con accompagnamento corale e musicale
ore 10.45Saluto delle autorità e relazione di contestualizzazione Storica
ore 11.30Salva d’onore e deposizione della corona in ricordo dei circa 27.000 soldati dei due schieramenti caduti e dispersi fra il 10 e il 29 giugno 1917
ore 11.45Conclusione della commemorazione con l’Inno Europeo eseguito dai cori parrocchiali presenti, accompagnati dalla Banda Civica di Borgo ValsuganaAl termine della cerimonia sarà possibile pranzare presso la zona ristoro appositamente allestita nelle immediate vicinanze",,2017-06-11T09:30:00+02:00,2017-06-11T15:00:00+02:00,A partire dalle 9.30,,,"Località Civerone, Castelnuovo",46.033059,11.49539,"Localit&agrave, Civerone, Castelnuovo",,,Famiglia,,,,,Commemorazione,A 100 anni dalla battaglia dell'Ortigara,,,,,,,,http://www.comunitavalsuganaetesino.it/|www.comunitavalsuganaetesino.it,,esterno,,,0.0,,,Comune di Castelnuovo
5772408698832f630f2e9d0150150780,2017-06-11T09:15:00+02:00,2017-05-17T11:16:01+02:00,Gusto di vivere il Lagorai,,/var/comunitavalsugana/storage/images/applicazioni5/openagenda/eventi/gusto-di-vivere-il-lagorai5/3046829-1-ita-IT/Gusto-di-vivere-il-Lagorai.jpg,"A partire da domenica 21 maggio 2017 e fino all'1 ottobre le visite guidate &quot,Gusto di vivere il Lagorai&quot,: un'uscita sul territorio del Comune di Castel Ivano insieme con gli accompagnatori di media montagna.","
&quot,Gusto di vivere il Lagorai&quot, accompagnerà ospiti e residenti alla riscoperta di alcuni fra i più preziosi scorci del Comune di Castel Ivano. Si parte dal Centro Sportivo di Agnedo per proseguire lungo l'argine del torrente Chieppena e arrivare alla sede del simposio di scultura su granito &quot,Pietre d'Acqua&quot,. A qualche centinaio di metri sarà possibile visitare l'Oasi Faunistica di Castel Ivano e salire quindi la collina che porta all'antico maniero, dove è prevista la degustazione dei prodotti tipici locali. L'uscita prosegue poi in direzione di Agnedo lungo la &quot,via Erta&quot,, con tappe all'antica &quot,fusina&quot, Zanghellini e ad alcune testimonianze della grande guerra, per concludersi nuovamente al Centro Sportivo.Le passeggiate si svolgeranno tutte le domeniche a partire dal 21 maggio fino al 1 ottobre. L'orario di partenza è fissato per le 9.15 presso il Centro Sportivo. Per ulteriori informazioni e per eventuali prenotazioni rivolgersi presso l'azienda per il Turismo Valsugana Lagorai – Terme – Laghi al numero 0461 727700.",http://www.comunitavalsuganaetesino.it/content/download/205592/3046832/2/Flyer_210x148mm_Oasi_3.pdf,2017-06-11T09:15:00+02:00,2017-06-11T12:30:00+02:00,Dalle 9.15 alle 12.30,,Dal 21 maggio all'1 ottobre 2017,Centro sportivo di Agnedo - Castel Ivano,46.052922,11.52292,,"Durata: 3 ore di cammino, comprese soste nei punti di interesse e degustazioneRitrovo: 9.15 presso Centro di Alpinismo LagoraiTermine: 12.30Tipologia utente: attività per tutti, bambini e adulti (minimo 1 partecipante, massimo 25)Costo: 12,00 € inclusa la quota accompagnatore media montagna e degustazione, 2,00 € per i bambini under 12Difficoltà: percorso facile in parte su sentiero, brevi tratti in salita,Consigliate calzature idonee per percorrere un sentiero a tratti un po’ sconnesso
PARCO ACCESSIBILE GRATUITAMENTEPARCHEGGIO PARCO PUBBLICO E AREA LIMITROFA AL CASTELLO",,Famiglia,"12,00 € inclusa la quota accompagnatore media montagna e degustazione, 2,00 € per i bambini under 12",,,,"Enogastronomia,Escursione,Visita guidata",,,,,,0461 727700,,gabriele.tisi@gmail.com,http://www.visitvalsugana.it/it/|Visitvalsugana,,esterno,,,0.0,,,Comune di Castel Ivano
