remoteId,published,modified,Titolo,Eventuale sottotitolo,Tipo di evento,Identificativo dell'evento,Date ed orari dell'evento,Descrizione breve,Argomenti,Descrizione completa,Galleria immagini,Video,Iniziativa di cui fa parte,Destinatari,Informazioni sui destinatari,Luogo dell'evento,lat,lon,address,Presenti all'evento,E' gratuito,Informazioni sui costi,Offerta,Locandina,Allegati,Punti di contatto,Contatti,Ulteriori informazioni,Organizzatori,Informazioni sugli organizzatori,Patrocinio,Sponsor,Persone o organizzazioni che hanno composto un'opera eseguita durante l’evento,Chi presenta,Servizio di traduzione curato da,Lingue usate all'evento,Numero massimo di posti,Tempo di lettura,Parole chiave,Valutazione dell'evento,Appuntamenti,Recensione,Indicato per
e293109004d4b6007a62626572ffb935,2024-01-24T15:01:40+01:00,2024-01-24T15:01:40+01:00,Che lingua ti ha mangiato il gatto?,,Evento di formazione,,,Punto lettura di Calceranica al Lago,"Istruzione
Biblioteca",Letture con incursioni nella lingua inglese per bambini dai 3 ai 7 anni!,,,,Bambini,,,,,,,,,https://calceranica.pnrr.comunweb.it/ocmultibinary/download/1559/24381/1/9db350d2e0fe30b35ceaf8bbb5a243b8.jpg/file/Calceranica_che+lingua+ti+ha+mangiato+il+gatto.jpg,Contatti Ufficio Segreteria,,Prenotazione obbligatoria ,,,,,,,,,0,2,,,,,
45cc3a5e4e0b92fd3eb847cc17e0056d,2024-01-30T11:47:18+01:00,2024-01-30T15:27:09+01:00,Carnevale dei bambini,,Raduno di comunità,,,"Festa in piazza con sfilata delle mascherine, maccheroni, brulè e the caldo.","Demografia e popolazione
Associazioni
Volontariato
Questioni sociali","Il Gruppo Alpini di Calceranica al Lago organizza:Sabato 10 febbraio alle ore 14.30 in Piazza Municipio sfilata delle mascherine.Per le mascherine che sfileranno ci saranno grostoli e coriandoli e alle ore 15.30 estrazione premi.Per tutti maccheroni al ragù o alle sarde, brulè e the caldo.",Carnevale,,,"Bambini,Famiglie,Giovani,Adulti,Anziani",,,,,,,Iscrizione sfilata delle mascherine,https://calceranica.pnrr.comunweb.it/content/download/1602/25040/3/CARNEVALE+DEI+BAMBINI+2024+con+cornicetta.pdf,,Contatti Area Segreteria Generale,,,Gruppo Alpini Calceranica,,,,,,,,0,2,,,,,
023ac5af7120951ec36bfcf45a3232c4,2024-02-06T16:40:24+01:00,2024-02-06T16:40:24+01:00,KAMISHIBAI letture con il teatrino giapponese,,"Incontro con esperti,Evento di formazione",,,Letture per bambine e bambini da 4 a 10 anni.,"Istruzione
Biblioteca",Letture con il teatrino giapponese per bambine e bambini da 4 a 10 anni  presso il Puto di lettura di Calceranica al Lago giovedì 15 febbraio 2024 ore 17:00,Biblioteca intercomunale,,,Bambini,,,,,,,,https://www.comune.calceranica.tn.it/content/download/1628/25305/1/kamishibai+15+02+2024.pdf,,Punto di lettura Calceranica al Lago,,,,,,,,,,Italiano,0,2,,,,,
1da5f6653bdce8be0927adbc1ffa78ca,2024-02-26T16:46:35+01:00,2024-02-26T16:51:04+01:00,TRE QUARTI circo - musica - teatro,,Manifestazione artistica,,,"Spettacolo di circo, teatro e musica &quot;Tre Quarti&quot; a cura di Veronique Ensemble.","Questioni sociali
Politica della gioventù
Politica familiare","Comitato Circus Lake e Veronique Ensemple presentano lo spettacolo Tre Quarti - comicità, equilibrismo e poesia.Di e con Luca Salata, Davide Salata, Tommaso Brunelli e Veronique Couteau.Regia di Giacomo Costantini, Circo ElGrito - Spettacolo vincitore premio Scintille 2017.",Pagliaccio,,,"Adulti,Anziani,Bambini,Famiglie,Giovani",,,,,,Entrata a offerta libera. Prenotazione consigliata.,,https://www.comune.calceranica.tn.it/content/download/1653/25846/3/circus+lake.pdf,,Comitato Circus Lake,,Info e prenotazioni: www.circuslakefest.it,,,,,,,,Italiano,0,2,,,,,
c96c58ef1b5f390b372c188d9565dd1c,2024-03-06T11:22:04+01:00,2024-03-06T11:58:03+01:00,I LUNAdì dell'Ortazzo,,"Evento sociale,Evento culturale",,,Un giardino sottosopra: ospitare pipistrelli ed altre specie selvatiche utili.,"Agricoltura, silvicoltura e pesca
Ambiente","L'Associazione L'Ortazzo organizza presso la Sala sociale del Comune di Calceranica al Lago, Via Don E. Angeli, una serata con accesso libero e gratuito sul tema &quot;Un giardino sottosopra: ospitare pipistrelli ed altre specie selvatiche utili&quot; con Liana Trentin.",L'ortazzo,,,"Adulti,Anziani,Bambini,Famiglie,Giovani",,Sala sociale,,,,,,https://www.comune.calceranica.tn.it/content/download/1697/27202/2/Locandina-LunAdi%CC%80-Ortazzo-2024+%28002%29.png,,Associazione L'Ortazzo,,,,,,,,,,,0,2,,,,,
f91c2ecb0d71045eb654d45cc4711019,2024-03-25T10:17:16+01:00,2024-03-25T15:54:18+01:00,Spettacolo teatrale SOGNO DI UNA NOTTE DI MEZZA ESTATE,,"Evento sociale,Evento culturale",,,L'equipe educativa Oltretutto e i ragazzi de la Bottega teatrale di Caldonazzo presentano lo spettacolo SOGNO DI UNA NOTTE DI MEZZA ESTATE.,"Questioni sociali
Politica della gioventù",L'equipe educativa Oltretutto e i ragazzi de la Bottega teatrale di Caldonazzo presentano lo spettacolo SOGNO DI UNA NOTTE DI MEZZA ESTATE.Regia di Matteo Pasqualini.Arpa: Anna NicolussiLuci: Giuseppe TamaniniCostumi: Giuliana Pagnacco,Teatro,,,"Adulti,Anziani,Bambini,Famiglie,Giovani",,Teatro comunale S.Ermete,,,,,,https://www.comune.calceranica.tn.it/content/download/1721/27571/4/WhatsApp+Image+2024-03-19+at+15.54.57+%281%29+%28002%29.jpeg,,OLTRETUTTO APPM,,,Comune di Calceranica,,,,,,,Italiano,0,2,,,,,
a4d522ee1bef5f628a51c3c5535c9c98,2024-03-27T16:07:30+01:00,2024-03-27T16:07:30+01:00,Seduta del Consiglio comunale,,Evento politico,,,Seduta del Consiglio comunale di Calceranica al Lago,"Politica
Comunicazione istituzionale",Seduta del Consiglio comunale,sala riunioni,,,Adulti,,Caserma Vigili del Fuoco volontari di Calceranica al Lago,,,,,,https://www.comune.calceranica.tn.it/content/download/1733/27799/1/AVVISO+SEDUTA+DEL+CONSIGLIO.pdf,,Contatti Area Segreteria Generale,,,,,,,,,,Italiano,0,2,,,,,
742a993e926e2adcf3ba23913fbb0b91,2024-04-10T11:51:46+02:00,2024-04-19T14:56:18+02:00,Che lingua ti ha mangiato il gatto?,,Evento culturale,,,Letture con incursioni nella lingua inglese per bambine e bambini da 3 a 7 anni,"Istruzione
Biblioteca",Letture con incursioni nella lingua inglese per bambine e bambini da 3 a 7 anni,Inghilterra,,,Bambini,,Biblioteca comunale,,,,,,https://www.comune.calceranica.tn.it/content/download/1759/28245/5/16+04+Che+lingua+ti+ha+mangiato+il+gatto+%286%29.png,,Punto di lettura Calceranica al Lago,,,,,,,,,,"Italiano,Inglese",0,2,,,,,
be350149f6ce3a543319a0ce0dc86933,2024-05-06T16:45:30+02:00,2024-05-06T17:07:08+02:00,Mercato settimanale estivo ,,Evento stagionale commerciale,,,Mercato estivo settimanale del giovedì,"Economia
Commercio ambulante
Mercato",Tutti i giovedì a partire dal 13 giugno 2024 e fino al 29 agosto 2024 si terrà il mercato settimanale estivo a Calceranica al Lago.,mercato settimanale,,,"Adulti,Anziani,Bambini,Famiglie,Giovani",,Mercato ,,,,,,,,Contatti Area Demografica e Commercio associato,,,,,,,,,,,0,2,,,,,
082adf84afc8c903c93e03799f9e08e4,2024-05-06T15:46:12+02:00,2024-05-06T15:46:12+02:00,Mercato saltuario 30 giugno 2024 - Fiera S.S. Pietro e Paolo,,Evento stagionale commerciale,,,Mercato saltuario domenica 30 giugno 2024,"Economia
Commercio al minuto
Commercio ambulante",Appuntamento annuale con il mercato saltuario &quot;Fiera S.S. Pietro e Paolo&quot; previsto il giorno 30 giugno 2024.,Fiera ,,,"Adulti,Bambini,Famiglie,Giovani,Anziani",,Palazzo del Municipio,,,,,,,,Contatti Area Demografica e Commercio associato,,,,,,,,,,,0,2,,,,,
464fdec42a36efca0ec29d8774f7e59a,2024-07-23T10:06:20+02:00,2024-07-23T10:06:20+02:00,GIORNATA MONDIALE DELLA PREVENZIONE DELL'ANNEGAMENTO,,Evento di formazione,,,In occasione della Giornata Mondiale della Prevenzione dell'Annegamento fissata nel giorno 25 luglio sulle spiagge del lago di Caldonazzo si terrà l'evento “Bandiera Blu: al lago in sicurezza” - dimostrazioni di soccorso e pronto intervento a cura degli operatori del servizio “SPIAGGE SICURE”.,"Ambiente
Acqua
Diritto
Protezione civile
Sicurezza pubblica","L'istituzione della Giornata Mondiale della Prevenzione dell'Annegamento è un'iniziativa dell’OMS che segue la Risoluzione dell’ONU dell’aprile 2021 e che mira a evidenziare il tragico e profondo impatto dell'annegamento e a offrire strategie di prevenzione salvavita, seguendo il motto  “Ogni annegamento è prevenibile. Esistono soluzioni”.
Quest’anno in Italia tutte le località #BandieraBlu dedicheranno la giornata alla sensibilizzazione e all’informazione sulla necessità di prevenire annegamenti, attraverso incontri con istituzioni e operatori, dimostrazioni sulla sicurezza in spiaggia e sul primo soccorso.
Le amministrazioni Comunali di Calceranica al Lago, Caldonazzo, Levico Terme, Tenna e Pergine Valsugana, in collaborazione con la Comunità Alta Valsugana e Bersntol, L'Azienda per il Turismo Valsugana-Lagorai e la Security srl – raccogliendo l'invito della Fondazione FEE Italia , in occasione della Giornata Mondiale della Prevenzione dell'Annegamento fissata nel giorno 25 luglio - organizzano nelle spiagge di competenza l'evento “Bandiera Blu: al lago in sicurezza” - dimostrazioni di soccorso e pronto intervento a cura degli operatori del servizio “SPIAGGE SICURE”.Di seguito luoghi ed orari delle dimostrazioni: 12:00 / 12:45 presso spiaggia libera Levico Terme14:00 / 14:45 presso spiaggia Barche 1 Calceranica al Lago15:00 / 15:45 presso spiaggia Riviera Caldonazzo16:00 / 16:45 presso spiaggia Tenna17:00 / 17:45 presso spiaggia Darsena 1 Pergine Valsugana#drowningprevention #feeglobal #feeitalia #Bandierablu #BlueFlag #WorldDrowningPreventionDay #safewater #preventdrowning #watersafety #staysafe #safety #lifesaving #lifeguards #training #WHO #OMS",Salvataggio,,,"Adulti,Anziani,Bambini,Famiglie,Giovani",,Spiaggia alle Barche,,,,,,https://www.comune.calceranica.tn.it/content/download/1898/31036/1/Giornata+25+Luglio+ver2+%28002%29.png,,Contatti Azienda per il turismo Valsugana Lagorai,,,,,,,,,,Italiano,0,2,,,,,
abe69bba879b1d40d040e19d6152f15b,2024-07-23T15:18:38+02:00,2024-07-23T15:18:38+02:00,Seduta del Consiglio comunale,,Evento politico,,,Seduta del Consiglio comunale,"Politica
Vita istituzionale","IL SINDACOINVITA AD ASSISTERE ALLASEDUTA DEL CONSIGLIO COMUNALE DEL GIORNO 31.07.2024 ORE 18:30 c/o LA SALA INTERRATA DELLA SCUOLA DELL’INFANZIAVia Asilo, 2 ORDINE DEL GIORNO 


Ratifica della deliberazione della giunta comunale n. 54 di data 04.06.2024 concernente &quot;2^ variazione al bilancio di previsione per l'esercizio finanziario 2024-2026. Adozione in via d'urgenza da parte della giunta comunale ai sensi del co. 5 dell'art. 49 della L.R. 2/2018&quot;;

Bilancio di previsione per l'esercizio finanziario 2024-2026 – 1^ variazione di assestamento generale e controllo della salvaguardia degli equilibri di bilancio.


",Consiglio comunale.jpg,,,"Adulti,Giovani",,Amici della Scuola dell'Infanzia di Calceranica,,,,,,,,Contatti Area Segreteria Generale,,,,,,,,,,Italiano,0,2,,,,,
c7efb228ac301a64d9b127a5b50b744d,2024-09-16T15:40:38+02:00,2024-09-16T15:55:40+02:00,Progetto salute e benessere - servizi gratuiti alla comunità,,Evento sociale,,,"Il progetto Salute e Benessere, promosso dall’Associazione Tempora ODV, offre una serie di servizi sanitari gratuiti alle comunità di Altopiano della Vigolana, Caldonazzo, Calceranica al Lago, Tenna.",Questioni sociali,"L'Amministrazione ha aderito ad una progettualità volta alla salute e benessere della popolazione, finanziata dal Ministero del Lavoro e delle Politiche Sociali e coordinata da Tempora ODV.
L’iniziativa è denominata “Progetto Salute e Benessere” e propone diverse possibilità che sono in fase di costruzione, dall'assistenza domiciliare all'accompagnamento durante gli spostamenti, dalla consegna di medicinali all'attenzione socio-sanitaria, nonché opportunità di socializzazione e benessere, attraverso il sostegno di diverse figure.
Ogni servizio è pensato per costruire delle opportunità di comfort e supporto alla popolazione, in modo gratuito sui territori di Altopiano della Vigolana, Caldonazzo, Calceranica al Lago, Tenna.
E' stato attivato uno Sportello Informativo volto ad offrire:
- accesso guidato referti;
- assistenza prenotazioni online;
- servizio infermieristico gratuito, anche a domicilio, in base alle necessità;
- raccolta di bisogni ed adesione ai servizi sanitari gratuiti.
Questo ambulatorio mira peraltro ad intraprendere alcune iniziative volte per esempio ad alleggerire il carico di cura e assistenza per le persone bisognose di qualunque età e genere, rendere le famiglie con soggetti fragili preparate alle necessità in un’ottica di prevenzione, nonché facilitare, in generale, l’accesso e l’orientamento ai servizi.Lo Sportello di Calceranica al Lago, in Piazza Municipio, n. 5, è aperto ogni martedì dalle 15:00 alle 16:00.
Per qualsiasi info è possibile chiamare il numero 342 514 4241.
Se gradite inoltre saperne di più, potete consultare anche il sito https://www.saluteebenessere.org/Segnaliamo infine che l’iniziativa, coordinata da Tempora ODV, è nata e si svilupperà in collaborazione con ulteriori partner istituzionali, in particolare Comunità Alta Valsugana e Bersntol, Comuni Altopiano della Vigolana, Caldonazzo e Tenna, Apss, Apt Valsugana Lagorai, Fondazione Cassa Rurale Alta Valsugana e Distretto Famiglia.",Salute e benessere,,,"Adulti,Anziani,Famiglie",,Palazzo del Municipio,,,,,,,,Contatti Area Segreteria Generale,,,,,,,,,,Italiano,0,2,,,,,
f4cbcb484dbedb09264204b14753d1eb,2024-09-19T09:03:33+02:00,2024-09-19T09:05:27+02:00,"17° Rassegna teatrale ""En tra de noi"" memorial Livio e Carla Marchi",,"Evento culturale,Manifestazione artistica",,,Rassegna teatrale &quot;En tra de noi&quot; presso Teatro S. Ermete di Calceranica al Lago&quot;NOME IN CODICE AFRODITE&quot; di Valerio Piramo Filo ACS Punto 3 - Canale,Tempo libero,17° rassegna teatrale &quot;en tra de noi&quot; memorial Livio e Carla Marchi presso il Teatro S. Ermete di Calceranica al Lago,Teatro,,,"Adulti,Anziani,Bambini,Famiglie,Giovani",,Teatro comunale S. Ermete,,,,Per i costi contattare Filodrammatica,,,,Tasin Diego presidente Filodrammatica S.Ermete,,,Filodrammatica S. Ermete di Calceranica al Lago,,,,,,,Italiano,193,2,,,,,
e4bf36865c43019986602de9983fe262,2024-09-19T09:05:40+02:00,2024-09-19T09:07:41+02:00,"17° Rassegna teatrale ""En tra de noi"" memorial Livio e Carla Marchi",,"Evento culturale,Manifestazione artistica",,,Rassegna teatrale &quot;En tra de noi&quot; presso Teatro S. Ermete di Calceranica al Lago&quot;TRA I LUMINI E I FIORELLINI &quot; di Loredana Cont Felice Filo' di Pressano,Tempo libero,17° rassegna teatrale &quot;en tra de noi&quot; memorial Livio e Carla Marchi presso il Teatro S. Ermete di Calceranica al Lago,Teatro,,,"Adulti,Anziani,Bambini,Famiglie,Giovani",,Teatro comunale S. Ermete,,,,Per i costi contattare Filodrammatica,,,,Tasin Diego presidente Filodrammatica S.Ermete,,,Filodrammatica S. Ermete di Calceranica al Lago,,,,,,,Italiano,193,2,,,,,
5e46b4641b4d55aecba6b645305d15a9,2024-09-19T09:02:40+02:00,2024-09-19T17:16:07+02:00,"17° Rassegna teatrale ""En tra de noi"" memorial Livio e Carla Marchi",,"Evento culturale,Manifestazione artistica",,,Rassegna teatrale &quot;En tra de noi&quot; presso Teatro S. Ermete di Calceranica al Lago&quot;COME LE GALINE&quot; di Massimo LazzeriFilo S. Ermete di Calceranica al Lago,Tempo libero,17° rassegna teatrale &quot;en tra de noi&quot; memorial Livio e Carla Marchi presso il Teatro S. Ermete di Calceranica al Lago,Teatro,,,"Adulti,Anziani,Bambini,Famiglie,Giovani",,Teatro comunale S. Ermete,,,,Per i costi contattare Filodrammatica,,,,Tasin Diego presidente Filodrammatica S.Ermete,,,Filodrammatica S. Ermete di Calceranica al Lago,,,,,,,Italiano,193,2,,,,,
9309d8cc4e13186494696dbe7d37bff5,2024-09-23T10:05:30+02:00,2024-09-24T15:32:56+02:00,La 30 Trentina,,"Evento sportivo,Corsa",,,"30 km immersi nella natura della Valsugana con partenza e arrivo a Levico, passando per Caldonazzo, Calceranica al Lago, Tenna e Pergine Valsugana","Tempo libero
Sport","La gara partirà come ogni anno da Viale Vittorio Emanuele, nel centro di Levico Terme, per toccare durante il percorso i comuni di Caldonazzo, Calceranica al Lago, Tenna e Pergine Valsugana, costeggiando i laghi di Caldonazzo e Levico, in Valsugana. L'arrivo sarà sul lungo lago del Parco Segantini di Levico Terme dove vi attenderà la grande festa finale de La 30 Trentina con musica dal vivo, degustazione di prodotti tipici, le premiazioni della gara, gazebi con somministrazione di birra e il pasta party.Visita il sito WEB per maggiori info https://www.latrentatrentina.com/ In allegato Ordinanza temporanea parziale modifica circolazione stradale a Calceranica al Lago.",Run,,,"Adulti,Giovani",,Lago di Levico Terme,,,,Vedasi regolamentohttps://www.avaibooksports.com/inscripcion/la-30trentina-2024/reglamento/ ,,,https://www.comune.calceranica.tn.it/ocmultibinary/download/1975/32482/2/d3e3436af3a006b5652c3d6ba7fafb31.pdf/file/Ordinanza%2Bmodifica%2Bcircolazione%2Bstradale.pdf,ASD Non solo running ,,,,,,,,,,Italiano,0,2,,,,,
ae99705baf016b63b086ee1cd2a868f2,2024-09-25T08:55:22+02:00,2024-09-25T08:55:22+02:00,"Sistema di allarme IT-alert, nuovo test alle 10 del 26 settembre in Trentino ",,Evento sociale,,,"IT-alert, alle 10 del 26 settembre in Trentino suoneranno tutti i cellulariContinuano i test del sistema di allerta della Protezione Civile: questa volta si tratterà di un incidente nucleare","Ambiente
Questioni sociali","Il sistema informativo It-Alert è operativo in tutta Italia già da inizio anno, ma proseguono le esercitazioni anche a livello locale sulle specifiche tipologie di allarme. L’obiettivo è di testare la diffusione dei messaggi per l’informazione alla popolazione, ma anche le procedure interne alla Protezione civile del Trentino. Il prossimo test di questo tipo è in programma giovedì 26 settembre alle 10 e riguarderà un presunto allarme nucleare lanciato a seguito di un incidente avvenuto in Svizzera. La valutazione della ricezione del messaggio sugli smartphone (preceduto da un suono del tutto diverso dalle suonerie) sarà effettuata da decine di “sentinelle”. Le loro osservazioni si aggiungeranno a quelle raccolte attraverso i questionari on-line che saranno volontariamente compilati dalla popolazione.&quot;Questo è un MESSAGGIO DI TEST IT-alert. È in corso la SIMULAZIONE di un incidente nucleare in un impianto sito in paese estero con potenziali ripercussioni nella zona in cui ti trovi. Per conoscere quale messaggio riceverai in caso di reale pericolo e per compilare il questionario vai su www.it-alert.gov.it TEST TEST”. Si leggerà nel messaggio di test&quot;.
Si ricorda che per ricevere il messaggio non è necessario scaricare alcuna App. Il sistema It-Alert non comporta nessuna compromissione dei livelli di privacy.I prossimi test sono in programma il 7 ottobre alle ore 10 (ipotesi di collasso della diga di Pian Palù nel comune di Peio) e a fine ottobre (ipotesi di incidente industriale rilevante).",Attenzione,,,"Adulti,Bambini,Famiglie,Giovani,Anziani",,Palazzo del Municipio,,,,,,,,Contatti Area Segreteria Generale,,,,,,,,,,Italiano,0,2,,,,,
4753bb98036da1e447b09cd9430dcb75,2024-11-04T15:01:33+01:00,2024-11-04T15:01:33+01:00,"I toponimi di Calceranica al Lago, Caldonazzo e Tenna",,"Giornata informativa,Conferenza e summit",,,"Presentazione in previsione dell'uscita del XXV  volume del Dizionario toponomastico  trentino con i nomi locali dei comuni di Calceranica al Lago, Caldonazzo e Tenna ","Ambiente
Demografia e popolazione","In previsione dell'uscita del XXV volume del Dizionario toponomastico trentino &quot;I nomi locali dei comuni di Calceranica al Lago, Caldonazzo, Levico Terme, Tenna&quot; la dott.ssa Lydia Flöss (Soprintendenza per i Beni e le Attività culturali), curatrice del volume, propone alla popolazione dei comuni di Calceranica al Lago, Caldonazzo e Tenna un incontro sull'argomento. Prima di procedere alla stampa del volume l'Ufficio Beni archivistici espone (in biblioteca) i materiali originali con lo scopo di consentire, a chi fosse interessato, di aggiungere toponimi mancanti o di modificare toponimi già presentMartedì 5 novembre alle ore 16:00 in biblioteca a Caldonazzo.",Chiesa di S.Ermete,,,"Adulti,Anziani,Famiglie",,,46.004108,11.242561,Via della Scuola 38050 Calceranica al Lago,,,,,,https://www.comune.calceranica.tn.it/ocmultibinary/download/2018/33436/1/14d2b3eb149ed749aeddd6238b030a62.png/file/LOCANDINA%2BINCONTRO%2BDIZIONARIO%2BTOPONOMASTICO%2BTRENTINO.png,Punto di lettura Calceranica al Lago,,,,,,,,,,Italiano,0,2,,,,,
