remoteId,published,modified,Titolo,Eventuale sottotitolo,Tipo di evento,Identificativo dell'evento,Date ed orari dell'evento,Descrizione breve,Argomenti,Descrizione completa,Galleria immagini,Video,Iniziativa di cui fa parte,Destinatari,Informazioni sui destinatari,Luogo dell'evento,lat,lon,address,Presenti all'evento,E' gratuito,Informazioni sui costi,Offerta,Locandina,Allegati,Punti di contatto,Contatti,Ulteriori informazioni,Organizzatori,Informazioni sugli organizzatori,Patrocinio,Sponsor,Persone o organizzazioni che hanno composto un'opera eseguita durante l’evento,Chi presenta,Servizio di traduzione curato da,Lingue usate all'evento,Numero massimo di posti,Tempo di lettura,Parole chiave,Valutazione dell'evento,Appuntamenti,Recensione,Indicato per
3d8f73000b8360933fa500351ed61888,2024-01-16T11:11:05+01:00,2024-01-16T11:11:05+01:00,Cristiano Militello Show,,"Evento sociale,Evento culturale",,,"
Spettacolo al Paladolomiti di Pinzolo: raccolta fondi a favore degli Amici del Paolin.Sci e disabilità un binomio possibile",Tempo libero,"Attore, cabarettista, conduttore radiofonico e televisivo. Cristiano Militello acuto osservatore dei modi di vivere dell'uomo moderno, mette in atto sapientemente e a ritmo serrato il monologo contenente vizi, comportamenti, abitudini, di tutti noi gente comune.Il ricavato dello spettacolo verrà utilizzato per l'acquisto di particolari attrezzature destinate all'insegnamento dello sci alle persone disabili.",,,,"Adulti,Anziani,Bambini,Famiglie,Giovani",,PalaDolomiti di Pinzolo,,,,,,,,Contatti Ufficio Segreteria,,,,,,,,,,,0,2,,,,,
e162362cd1c31ae0b9237875b40474e7,2024-01-16T11:16:42+01:00,2024-01-16T11:36:54+01:00,Mercato settimanale,,Evento d'affari o commerciale,,,"Il mercato settimanale si svolge tutti i mercoledì nel centro storico di Pinzolo, in viale Guglielmo Marconi","Economia
Commercio ambulante","Presso le bancarelle dislocate nel centro potrete fare acquisti di prodotti enogastronomici, ma anche abbigliamento, scarpe, accessori, oggettistica, casalinghi e molto altro.",,,,"Adulti,Anziani,Bambini,Famiglie,Giovani",,,,,,,,,,Contatti Ufficio Segreteria,,,,,,,,,,,0,2,,,,,
a473cc348f4321dc7fa1821c4d642aeb,2024-05-08T10:25:48+02:00,2024-05-08T14:21:13+02:00,Alimentarsi bene per restare in salute,,"Evento culturale,Evento sociale,Evento di formazione",,,giovedì 23 maggio ore 20.30 a Tione di Trento sede della Comunità delle Giudicarie Sala Sette Pievi.,Questioni sociali,"Le APSP del territorio delle Giudicarie promuovono, nella prospettiva della promozione del benessere e di una migliore qualità della vita, una serata sul tema dell'alimentazione, nutrizione e invecchiamento attivo a cura della dott.ssa Elisa Pichler, biologa nutrizionista. Verrà illustrata la Guida ai servizi e agli interventi a favore degli anziani e delle loro famiglie nel territorio delle Giudicarie a cura della dott.ssa Cinzia Fioroni. ",,,,Famiglie,,Sede Comunità delle Giudicarie,,,,,,,https://www.comune.pinzolo.tn.it/ocmultibinary/download/2208/52655/7/df324f8e1069d196d42677207ee30c13.pdf/file/ALIMENTARSI%2BBENE%2BPER%2BRESTARE%2BIN%2BSALUTE%2B23%2Bmaggio%2B2024.pdf,Contatti Comunità delle Giudicarie,,,,,,,,,,,0,2,,,,,
8939a7f4c9ff297c1139a5bb18953565,2024-05-10T11:48:18+02:00,2024-05-10T11:56:08+02:00,Uno sguardo alla violenza di genere,,Evento culturale,,,martedì 14 maggio 2024 ore 20.30Sala Sette Pievi presso la Comunità delle Giudicarie Tione di Trento,Questioni sociali,Sala Sette Pievi della Comunità delle Giudicarie a Tione di TrentoE' possibile collegarsi al link:meet.google.com/ihd-ckct-jfg,,,,"Adulti,Giovani,Famiglie",,Sede Comunità delle Giudicarie,,,,,,https://www.comune.pinzolo.tn.it/content/download/2219/52903/3/Benessere+in+Comunit%C3%A0+-+secondo+incontro.pdf,,Contatti Comunità delle Giudicarie,,,,,,,,,,,0,2,,,,,
77a693edbf16a3ebec4a5d509ed4e668,2024-05-14T10:49:40+02:00,2024-05-15T10:30:13+02:00,Un viaggio tra emozioni ed affettività - dott.re Alberto Pellai,,"Evento sociale,Evento culturale",,,Il ruolo dell'educazione affettiva nella gestione delle emozioni per un migliore benessere psicofisico.,"Questioni sociali
Politica familiare","presentazione percorso formativo sull'educazione affettiva ed emotiva, che si svolgerà in autunno.",,,,"Adulti,Famiglie",,PalaDolomiti di Pinzolo,,Rossini Laura,,,,https://www.comune.pinzolo.tn.it/content/download/2221/52975/4/distretto+famiglia.JPG,,Contatti Area Biblioteca,,,,,,,,,,,0,2,,,,,
4509a672069e4894f93051bfacf44454,2024-05-23T16:24:51+02:00,2024-05-23T17:01:13+02:00,Cinema a Pinzolo,,"Evento culturale,Manifestazione artistica,Proiezione cinematografica",,,Ecco la programmazione dei film ,"Istruzione
Tempo libero","Programmazione dei film dal 24 maggio al 13 giugno 2024. Dal 9 al 13 giugno Festa del cinema con ingresso unico al prezzo speciale di 3,5 euro",,,,"Adulti,Anziani,Bambini,Famiglie,Giovani",,PalaDolomiti di Pinzolo,,,,"Biglietto intero € 7,00, ridotto € 5,00 (fino ai 25 anni, soci delle Pro Loco di Rendena presentando tessera UNPLI)Ingresso gratuito dal terzo figliodal 9 al 13 giugno in concomitanza con Cinema in festa, ingresso unico ad € 3,5Possibilità di abbonamento a 5 spettocoli al costo di € 20,00","ridotto € 5,00 (fino ai 25 anni e soci delle Pro Loco di Rendena presentando la tessera UNPLI)",https://www.comune.pinzolo.tn.it/content/download/2232/53298/2/CTT_PINZOLO_CINEMA-mag-giu24_locA3_alta.pdf,,Contatti Biblioteca comunale ,,,,,,,,,,,452,2,,,,,
5a95c9b23e878d704b741a91a7607b66,2024-05-23T11:20:44+02:00,2024-05-23T11:20:44+02:00,Incontro con la popolazione per circonvallazione di Pinzolo,,Dibattito / Dialogo pubblico,,,Invito alla popolazione e quanti interessati all’opera pubblica per i lavori di realizzazione della circonvallazione di Pinzolo.,"Trasporto pubblico
Rete stradale","Le amministrazioni dei Comuni di Pinzolo, Carisolo e Giustino, invitano la popolazione e quanti interessati all’opera pubblica per i lavori di realizzazione della circonvallazione di Pinzolo sulla S.S. 239 di Campiglio – U.F. 1 C.C. Giustino I, Pinzolo e Carisolo I”.",,,,Adulti,,PalaDolomiti di Pinzolo,,,,,,https://www.comune.pinzolo.tn.it/content/download/2225/53077/1/Locandina+circonvallazione.pdf,,Contatti Ufficio Segreteria,,,,,,,,,,,0,2,,,,,
4b223fe7c441a1cff9cbf02cb590a139,2024-05-23T17:31:34+02:00,2024-05-23T17:36:33+02:00,Challengers,,Proiezione cinematografica,,,In programma il nuovo film di Luca Gadagnino  ,Tempo libero,"Film Regia di Luca GuadagninoCon Zendaya, Josh O'Connor, Mike Faist, Scottie Di GiacomoUsa, 2024 Drammatico, sentimentale, sportivo durata 129'",Challengers,,Cinema a Pinzolo,"Adulti,Giovani",Film consigliato agli amanti del tennis,PalaDolomiti di Pinzolo,,,,"Intero € 7, ridotto € 5 (under 25, soci delle Pro Loco di Rendena presentando la tessera UNPLI)Ingresso omaggio dal terzo filgioPossibilità di abbonamento: 5 proiezioni a scelta € 20,00","ridotto € 5,00 (fino ai 25 anni e soci delle Pro Loco di Rendena presentando la tessera UNPLI)",https://www.comune.pinzolo.tn.it/content/download/2236/53383/3/challengers+locandina.jfif,,Contatti Biblioteca Pinzolo comunale ,,,,,,,,,,,452,2,,,,,
4d1c1272e3c7e9234ebb7d907785e302,2024-05-23T17:58:50+02:00,2024-05-23T17:58:50+02:00,Vita da gatto,,Proiezione cinematografica,,,Film per famiglie,Tempo libero,"Vita da gatto è un film del 2023 diretto da Guillaume Maidatchevsky. Ispirato al romanzo Rroû di Maurice Genevoix, il film parla di una bambina parigina Clemence e un gattino chiamato Rroû.",,,Cinema a Pinzolo,"Famiglie,Bambini",,PalaDolomiti di Pinzolo,,,,"Intero € 7, ridotto € 5 (under 25, soci delle Pro Loco di Rendena con tessera Unpli)ingresso omaggio dal terzo figlioabbonamento a 5 proiezioni a scelta  20,00","ridotto € 5,00 (fino ai 25 anni e soci delle Pro Loco di Rendena presentando la tessera UNPLI)",https://www.comune.pinzolo.tn.it/content/download/2239/53437/1/locandina-film-vita-da-gatto-2024.webp,,Contatti Biblioteca Pinzolo comunale ,,,,,,,,,,,452,2,,,,,
aeab086dbee5fb07fb136290603f1086,2024-05-29T09:38:16+02:00,2024-05-29T09:41:52+02:00,"Serata di sensibilizzazione ""Cambio Vita""",,"Evento sociale,Incontro con esperti,Riunione esperti / portatori interesse",,,Serata di sensibilizzazione aperta alla Comunità e promossa dall'Associazione dei Club Alcologici Territoriali e di Ecologia Familiare delle Giudicarie.,"Questioni sociali
Assistenza sociale",Serata ricca di testimonianze e riflessioni dal mondo dei club e di brani musicali proposti dal gruppo Rocce Rosse.Si parlerà di fragilità come condizione umana che unisce e che può rendersi anche risorsa per la comunità intera.,,,,"Adulti,Giovani,Famiglie,Anziani",,Sede Comunità delle Giudicarie,,,,,,https://www.comune.pinzolo.tn.it/content/download/2242/53545/2/volantino+29+maggio.pdf,,Contatti Ufficio Segreteria,,,,,,,,,,,0,2,,,,,
aada2864355a50eb9d0633b9b77de954,2024-05-28T12:23:43+02:00,2024-05-29T09:21:12+02:00,"Progetto ""Benessere in Comunità"" - Invito alla vita",,"Evento sociale,Incontro con esperti",,,Progetto provinciale di prevenzione del suicidio.La comunità che si attiva e si prende cura di se stessa.,"Questioni sociali
Assistenza sociale",Terzo incontro &quot;Benessere in Comunità&quot; promosso dalla Comunità delle Giudicarie dal titolo &quot;Invito alla Vita. Progetto provinciale di prevenzione del suicidio. La comunità che si attiva e si prende cura di se stessa&quot;.,,,,"Adulti,Anziani,Famiglie,Giovani",,Sede Comunità delle Giudicarie,,,,,,https://www.comune.pinzolo.tn.it/content/download/2241/53509/2/Benessere+in+Comunit%C3%A0+-+terzo+incontro+%28002%29.pdf,,Contatti Ufficio Segreteria,,,,,,,,,,,0,2,,,,,
01482152e3d304e96eb7f060666dfd80,2024-06-12T12:45:35+02:00,2024-06-12T12:45:35+02:00,MOUNTAIN BEAT FESTIVAL,,Evento culturale,,,Una settimana di bassa e alta frequenza. Dai concerti con artisti noti in location uniche ed esperienze lente e inedite da godere a contatto con la natura. ,Tempo libero,"Il programma farà battere il cuore ad alta frequenza con il concerto di artisti conosciuti, e a bassa frequenza con esperienze rilassanti nella natura. Nel verde del paese, nella Pineta, appena fuori dal centro, dove il fiume Sarca scorre verso il lago di Garda, verrà allestito anche un Campo Base, il cuore pulsante di questa settimana di festa e connessione con la natura. Per il programma completo, consultare:https://www.campigliodolomiti.it/it/eventi/mountain-beat-festival ",,,,"Giovani,Adulti,Anziani,Bambini,Famiglie",,Pineta di Pinzolo,,,,Concerti ed esperienze a pagamento e su prenotazione. Accesso al Villaggio Pineta e area relax gratuito.,,,,Contatti Madonna di Campiglio Azienda per il Turismo S.p.A.,,,,,,,,,,,0,2,,,,,
a29ea0d0823693d39afae7c43c3596cf,2024-06-29T11:38:29+02:00,2024-06-29T15:30:53+02:00,Cinema luglio 2024,,"Evento culturale,Manifestazione artistica,Proiezione cinematografica",,,La programmazione dei film per il mese di luglio al PalaDolomiti di Pinzolo,"Istruzione
Biblioteca
Tempo libero
Patrimonio culturale","Per gli appasionati del grande schermo la programmazione del PalaDolomiti accontenta un po' tutti. Si spazia dall'atteso Inside out 2, al raffinato film di Laetitia Colombani La treccia, passando per il primo capitolo di Horizon: an american saga di Kevin Costner senza dimenticare i più piccoli a cui sono dedicati altri 4 cartoni animati",testata,,,"Adulti,Anziani,Bambini,Famiglie,Giovani",,PalaDolomiti di Pinzolo,,,,"BigliettiIntero 7 €Ridotto (under 25, soci delle Pro Loco di Rendena con  tessera UNPLI) 5 €ingresso omaggio dal terzo figlio","Cinema Revolution per film europei
Abbonamento valido per 5 proiezioni",https://www.comune.pinzolo.tn.it/content/download/2275/54605/4/CTT_PINZOLO_CINEMA-estate24_loc31x64cm.pdf,,Contatti Biblioteca Pinzolo comunale ,,,,,,,,,,,450,2,,,,,
9c1cad30b1b76c016ff692cd4c5199c1,2024-06-29T12:06:21+02:00,2024-06-29T12:06:21+02:00,Stagione estiva dei concerti,,"Evento culturale,Manifestazione artistica,Manifestazione musicale",,,12 concerti di musica per allietare l'estate di residenti e ospiti,"Istruzione
Biblioteca
Tempo libero
Patrimonio culturale
Turismo","Musica classica declinata in 12 appuntamenti, alcuni al PalaDolomiti, altri presso la chiesa di San Viglio ed uno d'organo nella chiesa di San Lorenzo",Orchestra Haydn al PalaDolomiti,,,"Adulti,Anziani,Famiglie,Giovani",,PalaDolomiti di Pinzolo,,,,Ingresso a pagamento per il concerto dell'Orchestra Haydn del 5 agosto e per il concerto Piano per il decennale del mestro Roberto Cominati del 16 agosto,,https://www.comune.pinzolo.tn.it/content/download/2280/54700/1/locandina+concerti+estate+2024.jpg,,Contatti Biblioteca Pinzolo comunale ,,,,,,,,,,,0,2,,,,,
bda5be8377024347a7093511c30f7079,2024-07-03T15:32:57+02:00,2024-07-03T15:32:57+02:00,Letture al parco,,"Evento culturale,Manifestazione artistica,Lettura (pubblica)",,,Ilaria accompagnerà i più piccoli fra tante meravigliose storie ,"Istruzione
Scuola materna
Tempo libero
Patrimonio culturale
Turismo",I bimbi fra i 3 e i 6 anni avranno la possibilità di trascorrere una piacevole ora  in compagnia della dolce Ilaria che racconterà loro storie bellissime tratte da bellissimi libri. In caso di pioggia l'appuntamento è presso la sala mansarda 24H presso la Casa della Cultura,Letture al Parco,,,Bambini,I bambini dovranno essere accompagnati da un adulto ,Biblioteca comunale di Pinzolo,,,,,,https://www.comune.pinzolo.tn.it/content/download/2282/54745/1/locandina+letture+estive+Ilaria.png,,Contatti Biblioteca Pinzolo comunale ,,,,,,,,,,Italiano,30,2,,,,,
27dece47b22ba91e165db87a7156da0a,2024-07-03T16:37:22+02:00,2024-07-03T16:37:22+02:00,Judicaria 116,,"Evento culturale,Lettura (pubblica),Conferenza e summit",,,Presentazione del n. 116 della rivista Judicaria,"Istruzione
Biblioteca
Tempo libero
Patrimonio culturale",Alla Casa della cultura con il direttore resonsabile della rivista Alberto Folgheraiter la presentazione del nuovo numero della rivista Judicaria dedicato in gran parte ai temi dell'emigrazione,presentazione,,,Adulti,,Casa della Cultura e del Sociale,,,,Possibilità di acquistare il numero della rivista,,https://www.comune.pinzolo.tn.it/content/download/2284/54790/1/Presentazione+pinzolo+Judicaria+copia.jpg,,"Contatti Biblioteca Pinzolo comunale 
Biblioteca",,,,,,,,,,Italiano,100,2,"Centro studi Judicaria,rivista,emigrazione",,,,
68051f38c11148c4117c13a8efa34f6d,2024-07-03T17:38:37+02:00,2024-07-03T17:38:37+02:00,Via con me,,"Evento culturale,Manifestazione artistica,Manifestazione musicale",,,Fra musica e parole un viaggio nella storia della canzone italiana d'autore,"Istruzione
Biblioteca
Tempo libero
Patrimonio culturale",Con il ritorno dell'estate ritorna la stagione dei concerti organizzata dal Comune di Pinzolo. Il primo appuntamento è dedicato alla canzone italiana d'autore ,Luca Pegoraro,,Stagione estiva dei concerti,"Adulti,Anziani,Giovani",,PalaDolomiti di Pinzolo,,,,"Ingresso gratuito, con possibilità di oblazione volontaria",,https://www.comune.pinzolo.tn.it/content/download/2302/55173/1/locandina+Pegoraro+5+luglio.png,,Contatti Biblioteca Pinzolo comunale ,,,,,,,,,,,450,2,,,,,
cbcb9f8e6a5f99da7d2def01628a3bd0,2024-07-03T16:55:07+02:00,2024-07-03T17:48:46+02:00,Letture al Parco,,"Evento di formazione,Manifestazione artistica,Lettura (pubblica)",,,Ilaria accompagna i più piccoli nel magico mondo dei libri e delle storie,"Istruzione
Biblioteca
Tempo libero
Patrimonio culturale",Ogni giovedì estivo nel Parco Ciclamino letture ad alta voce proposte da Ilaria,letture al parco,,,Bambini,I bambini dovranno essere accompagnati da un adulto,Parco Ciclamino,,,,,,https://www.comune.pinzolo.tn.it/content/download/2296/55014/2/locandina+letture+estive+Ilaria.png,,Biblioteca,,,,,,,,,,,0,2,,,,,
25ef34140cd518689286c5a6d63dccf6,2024-07-04T08:14:33+02:00,2024-07-04T08:14:33+02:00,Fisarmoniche classiche,,"Evento culturale,Manifestazione musicale,Manifestazione artistica",,,7 fisarmoniche sul palco per proporre pezzi di Mozart Bach ed altri brani classici,"Istruzione
Biblioteca
Tempo libero
Patrimonio culturale
Turismo",Partiture classiche rielaborate per un ensemble di sole fisarmoniche,Ensemble Fisarccordion,,Stagione estiva dei concerti,"Adulti,Famiglie,Giovani,Anziani",,PalaDolomiti di Pinzolo,,,,,,https://www.comune.pinzolo.tn.it/content/download/2305/55227/1/locandina+Fisarmoniche+12+luglio.jpg,,Contatti Biblioteca Pinzolo comunale ,,,,,,,,,,Italiano,450,2,"musica classica,concerto",,,,
ba38d78dba9f2768ed1ed9a2bfd492d9,2024-07-29T15:56:00+02:00,2024-07-29T16:05:44+02:00,Mostra degli artisti della Val Rendena e dintorni - XI edizione,,Evento culturale,,,"Il Comune di Pinzolo ospita anche per l’anno 2024 la “Mostra degli artisti della Val Rendena e dintorni”, XI edizione, che si terrà dal 9 al 19 Agosto presso la Sala Ludica del PalaDolomiti, orario apertura 17:00 - 22:00.","Tempo libero
Patrimonio culturale","Dal 9 al 19 Agosto, presso la sala ludica del PalaDolomiti di Pinzolo, si terrà l'XI edizione della &quot;Mostra degli artisti della Val Rendena e dintorni&quot;, con 44 artisti partecipanti che esporranno le proprie opere in una mostra d'arte collettiva.L'inaugurazione è alle ore 17.00 del giorno 9 Agosto 2024.L'ingresso è gratuito.",locandina mostra,,,"Adulti,Giovani,Famiglie,Bambini,Anziani",,PalaDolomiti di Pinzolo,,,,,,https://www.comune.pinzolo.tn.it/content/download/2374/56900/3/Manifesto.png,https://www.comune.pinzolo.tn.it/ocmultibinary/download/2374/56901/3/97bb19eeff4ca9098e74991508c67cfb.png/file/Locandina%2Bartisti.png,Contatti Ufficio Segreteria,,,,,,,,,,,0,2,,,,,
b22b9870e89c03bcbf74dc51090fd3a8,2024-08-27T09:29:39+02:00,2024-08-27T11:19:44+02:00,Fiera di Fine Estate 2024,,Evento d'affari o commerciale,,,Domenica 1 settembre si terrà la tradizionale &quot;fiera di fine estate&quot; tra le strade del paese di Pinzolo.,"Economia
Commercio ambulante","Presso le bancarelle dislocate nel centro potrete fare acquisti di prodotti enogastronomici, ma anche abbigliamento, scarpe, accessori, oggettistica, casalinghi e molto altro.",,,,"Famiglie,Adulti,Bambini,Anziani,Giovani",,Municipio di Pinzolo,,,,,,,,Contatti Area Polizia Locale,,,,,,,,,,,0,2,,,,,
c5d6d113ad029451a36229ba01ff90ae,2024-09-14T15:18:44+02:00,2024-09-14T15:25:35+02:00,Cinema al PalaDolomiti settembre ottobre,,"Evento culturale,Proiezione cinematografica",,,La programmazione cinematografica per i mesi di settembre e ottobre,"Istruzione
Biblioteca
Tempo libero
Patrimonio culturale",Continua la programmazione cinematografica al PalaDolomiti anche nei mesi autunnali con 8 film davvero imperdibili. ,Cinema,,,"Adulti,Anziani,Bambini,Famiglie,Giovani",Ogni pubblico può trovare un film di proprio interesse,PalaDolomiti di Pinzolo,,,,"Ingresso intero € 7, ridotto (under 25, soci Pro Loco Rendena con tessera UNPLI) ","Abbonamento valido per 5 proiezioni
Cinema Revolution per film europei",https://www.comune.pinzolo.tn.it/content/download/2383/57164/2/CTT_PINZOLO_CINEMA-settembre24_locA3.jpg,,Biblioteca,,,,,,,,,,,450,2,"Vermiglio ""Campo di battaglia"" ""Pericolosamente vicini"" Perdutamente ""Il magico mondo di Harold"" ""Joker follie à deux"" ""Madame Cliquot"" ""Ozi la voce della foresta""",,,,
581033ffd11dc16eab85e58435833e34,2024-09-14T15:42:35+02:00,2024-09-14T15:42:35+02:00,Montagna è solidarietà,,"Evento culturale,Evento sociale",,,Serata in ricordo di Clemente Maffei Guerét in occasione del Premio internazionale di Solidarietà Alpina,"Istruzione
Biblioteca
Tempo libero
Patrimonio culturale
Sport","Eva Lavinia Maffei, Marco Collini e Fausto De Stefani ricordano Clemente Maffei Guerét a 100 anni dalla nascita in occasione della consegna della Targa d'argento del Premio di Solidarietà Alpina",Guèret festeggiato a Pinzolo al rientro dall'impresa del Sarmento,,,"Adulti,Giovani",,PalaDolomiti di Pinzolo,,,,,,https://www.comune.pinzolo.tn.it/content/download/2385/57209/1/Locandina+serata+Gueret+Montagna+e+solidariet%C3%A0.+versione+social.jpg,,Società Alpinisti Tredentini - sezione di Pinzolo Alta Rendena,,,,,,,,,,,450,2,,,,,
ec5f48c2f1c6276570933ed790f53381,2024-10-07T18:53:26+02:00,2024-10-07T18:58:23+02:00,PalaDolomiti Teatro,,Evento culturale,,,Accanto alla programmazione cinematorgrafica il PalaDolomiti propone 2 spettacoli teatrali ,"Istruzione
Biblioteca
Tempo libero
Patrimonio culturale","Due spettacoli teatrali  ispirati alla musica vengono proposti al Paladolomiti. Giovedì 17 ottobre 2024 andrà in scena Sonata per tubi proposta dalla compagnia Nando e Maila, mentre giovedì 7 novembre Corrado d'Elia ci racconta quel genio di Amadeus Mozart",Sonata per tubi,,,"Adulti,Giovani","Due spettacoli che si faranno sicuramente aprezzare da giovani e adulti, in particolare quelli amanti della musica",Paladolomiti,46.159584,10.766105,"Paladolomiti, Viale della pace 38086 Pinzolo",,,"Biblitetto intero € 12,00","Ridotto (over 65, under 25)",https://www.comune.pinzolo.tn.it/content/download/2407/57910/3/LOcandina+teatro+autunno.jpg,,Biblioteca,Biblioteca di Pinzolo tel. 0465 503703 biblioteca.pinzolo@comune.pinzolo.tn.it,,Biblioteca Comunale,,,,,,,,450,2,,,,,
d5b1b5085b8b75e9a6a012da5dd71ee4,2024-10-22T17:38:07+02:00,2024-10-22T17:39:51+02:00,Ben di stomaco,,Evento culturale,,,Una serata per saper comprendere i segnali che il nostro stomaco di invia,"Istruzione
Biblioteca
Politica
Questioni sociali
Igiene pubblica",Incontro con un gastroenterologo di fama per imparare a prenderci cura di questo organo ed imparare a capire i segnali che ci invia,Ben di stomaco,,,"Adulti,Anziani",,Biblioteca comunale di Pinzolo presso Parco Ciclamino,0,0,,,,Al termine della serata sarà possibile acquistare il libro Ben di stomaco del dott. Andrea Zanoni,,https://www.comune.pinzolo.tn.it/content/download/2418/58087/2/Ben+di+stomaco+-+Andrea+Zanoni.jpg,,Contatti Biblioteca Pinzolo comunale ,,,,,,,,,,,0,2,,,,,
