remoteId,published,modified,Titolo,"Titolo breve",Immagine,Descrizione,"Locandina dell'evento",Inizio,Termine,Durata,Quando,Dove,Informazioni,Destinatari,Costi,Stato,Materia,Circoscrizione,Argomento,"Tipologia evento","Manifestazione cui fa parte",Associazione,Progressivo,Sottotitolo,Orario,lat,lon,address,Fonte
99a576be3a8a6680b694e3cd06a87097,2018-11-14T15:25:13+01:00,2018-11-14T15:25:13+01:00,"FESTA DELL'AMBIENTE","un luogo mille colori...",/var/valfloriana/storage/images/territorio/eventi-e-manifestazioni2/un-luogo-mille-colori/70288-1-ita-IT/un-luogo-mille-colori.jpg,"TITOLO: Un luogo mille colori. Festa dell’ambiente in Val di FiemmeÈ in programma domenica 18 novembre 2018, a partire dalle ore 15:00, l’evento “Un luogo mille colori”: un’occasione per festeggiare l’ambiente e riflettere ancora una volta sul cambiamento climatico.Sono i comuni di Castello-Molina di Fiemme, Capriana e Valfloriana, che da anni portano avanti azioni di sensibilizzazione e partecipazione della cittadinanza al tema, ad invitare tutta la cittadinanza presso sala Tisti, a Molina di Fiemme, in via segherie.Un tema, quello dal cambiamento climatico, che oggi sembra ancora più attuale, del quale si parla, ma dove la sensibilizzazione e l’informazione non sono mai abbastanza. Perché di cose da sapere ce ne sono sempre tante e proprio durante la giornata di domenica 18 novembre i cittadini potranno informarsi e partecipare.Una festa pensata per tutti: famiglie, bambini, interessati e non, curiosi. Un programma serrato che vuole stimolare il dibattito e la riflessione. Si parte alle ore 15:00 con le attività “Uso che ti (ri)uso”- laboratori creativi per bambini sul tema natalizio, “La bolletta un mistero” - alla scoperta del risparmio energetico e dell’energia green, con tavoli di confronto e lettura partecipata della bolletta, “L’erba del vicino” - il cambiamento climatico coinvolge tutti, scopriamo come si comportano gli altri attraverso il racconto di “buone pratiche” dall’Italia e dal Mondo, “Alternativa a chi?!” – testDrive di mobilità elettrica.Alle 16:00 sarà poi la volta di premiare i partecipanti all’omonimo concorso fotografico, per poi passare ad un momento di cinema. Alle 17:00 partirà infatti, sempre presso sala Tisti, la proiezione del film “Before the flood – Punto di non ritorno” – prodotto nel 2016 dal National Geographic in collaborazione con Leonardo DiCaprio: un viaggio in cinque continenti e nell'Artico per divulgare il futuro dei cambiamenti climatici.La proiezione del film sarà anticipata dalla visione del cortometraggio “Una semplice giornata” realizzato dai ragazzi di Castello-Molina di Fiemme per sensibilizzare i concittadini al tema.Ovviamente, proprio nel bel mezzo della giornata, un momento di merenda conviviale.e amministrazioni invitano quindi tutti a partecipare. Perché fare la propria parte nella lotta al cambiamento climatico è, oggi più che mai, necessario!","http://www.comune.valfloriana.tn.it/content/download/6363/70290/1/Senza titolo.png",2018-11-18T15:00:00+01:00,2018-11-18T22:00:00+01:00,,"domenica 18.11.2018","Sala Tisti - Via Segherie 48 Molina di Fiemme",,,,,,,,"Evento singolo",,,,,"15:00 - 22:00",46.272613,11.41745,"Predaia, Castello-Molina di Fiemme, Comunit&agrave, territoriale della Val di Fiemme, TN, Trentino-Alto Adige, 38033, Italia",
47ab443f159cc4667a8c200531e42796,2018-10-24T14:05:08+02:00,2018-10-24T14:08:07+02:00,"COME FARE IMPRESA IN UNA PICCOLA VALLE DI MONTAGNA",,/var/valfloriana/storage/images/territorio/eventi-e-manifestazioni2/come-fare-impresa-in-una-piccola-valle-di-montagna/69610-1-ita-IT/COME-FARE-IMPRESA-IN-UNA-PICCOLA-VALLE-DI-MONTAGNA.png,"
Una serata per aprire nuove opportunità, stimolare riflessioni attraverso storie imprenditoriali di aziende che dalla Val di Fiemme hannoraggiunte posizioni di rilievo nel loro segmento, nonostante - o grazie - alle sfide di questo territorio montano.
LORENZO DELLADIO (LA SPORTIVA SPA)
RICCARDO FELICETTI (PASTIFICIO FELICETTI SPA)
MARCO FELICETTI (FIEMME3000 SRL)
MARISA ZENI (EUROSTANDARD SRL)GIANNI MISCONEL (MISCONEL SRL)

    locandina pdf
",,2018-11-08T20:30:00+01:00,2018-11-08T23:30:00+01:00,,"Giovedì 8.11.2018","Palazzo Magnifica Comunità di Fiemme",,,,,,,,"Evento singolo",,,,,,0,0,,
394a41983cd248368c19305f60f3e110,2018-10-23T17:22:55+02:00,2018-10-23T17:22:55+02:00,"15^ rassegna teatrale","ONESTI SE NASSE.... FURBI SE DEVENTA DI LOREDANA CONT",/var/valfloriana/storage/images/territorio/eventi-e-manifestazioni2/onesti-se-nasse-furbi-se-deventa-di-loredana-cont/69585-1-ita-IT/ONESTI-SE-NASSE-FURBI-SE-DEVENTA-DI-LOREDANA-CONT.png,"Anni di crisi economica che coinvolge le famiglie. Gisella è casalinga, Bruno è in mobilità e il fglio Franco torna ad abitare in famiglia dopo la separazione. Per problemi di soldi anche Loretta, la sorella di Gisella, va a vivere da loro. In casa è ospite Mary, una signora eccentrica, facoltosa, simpatica che mangia e beve ma non paga e che è corteggiata da Vittorio in cerca di una moglie benestante. Si cerca di sopravvivere alla crisi escogitando qualcosa per avere più entrate, ma non è facile.Sembra che, in conclusione, a volte essere furbi può dare buoni risultati, a volte no... ",,2018-10-27T20:30:00+02:00,2018-10-27T23:30:00+02:00,"3 ORE","sabato 27.10.2018","teatro comunale Valfloriana",,,,,,,,"Evento singolo","Circolo Culturale Valfloriana - 15^ Rassegna teatrale",,,,,0,0,,
d147b8395705823caa4f22d9881d68fc,2018-10-12T10:21:04+02:00,2018-10-12T10:25:18+02:00,"Elezioni provinciali 2018 - Avviso apertura uffici comunali","Elezioni provinciali 2018 - Avviso apertura uffici comunali",/var/valfloriana/storage/images/territorio/eventi-e-manifestazioni/elezioni-provinciali-2018-avviso-apertura-uffici-comunali/69150-1-ita-IT/Elezioni-provinciali-2018-Avviso-apertura-uffici-comunali.jpg,"

    AVVISO
",,2018-10-11T10:18:00+02:00,2018-10-22T23:00:00+02:00,,,"SEDE COMUNALE",,,,,,,,"Evento singolo","ELEZIONI PROVINCIALI 21.10.2018 - cambio sede seggio elettorale Valfloriana",,,,,0,0,,
f2d9ad38051fb23141c12cb0586a670a,2018-10-12T10:14:35+02:00,2018-10-12T10:25:52+02:00,"ELEZIONI PROVINCIALI 21.10.2018","ELEZIONI PROVINCIALI 21.10.2018 - cambio sede seggio elettorale Valfloriana",/var/valfloriana/storage/images/territorio/eventi-e-manifestazioni/elezioni-provinciali-21.10.2018-cambio-sede-seggio-elettorale-valfloriana/69123-1-ita-IT/ELEZIONI-PROVINCIALI-21.10.2018-cambio-sede-seggio-elettorale-Valfloriana.jpg,"

    AVVISO
",,2018-10-12T10:11:00+02:00,2018-10-22T18:00:00+02:00,"2 GIORNI","21-22 OTTOBRE 2018","SCUOLA ELEMENTARE CASATTA 18/A",,,,,,,,"Evento singolo",,,,,,0,0,,
74931ef633a6e2a2dc98735d77cbba04,2018-07-19T15:00:44+02:00,2018-07-19T15:00:44+02:00,"""Qua no son miga en Merica.... qua""","Commedia teatrale a cura dei bambini della scuola elementare Casatta",/var/valfloriana/storage/images/territorio/eventi-e-manifestazioni/commedia-teatrale-a-cura-dei-bambini-della-scuola-elementare-casatta/67057-1-ita-IT/Commedia-teatrale-a-cura-dei-bambini-della-scuola-elementare-Casatta.png,"INGRESSO CON OFFERTA LIBERA, IL RICAVATO SARA’ DEVOLUTO ALL’ASSOCIAZIONE “ALE4m” ",,2018-07-27T20:30:00+02:00,,"2 ore","27 luglio 2018","Teatro comunale Casatta - Valfloriana",,,,,,,,"Evento singolo",,,,,,0,0,,
a34e03a0725c65f1f07d6528f65fadc8,2018-05-15T16:15:06+02:00,2018-05-15T16:32:30+02:00,"E' TEMPO DI AGIRE PER IL NOSTRO TERRITORIO","Incontro pubblico relativo all'efficientamento e risparmio energetico ",/var/valfloriana/storage/images/territorio/eventi-e-manifestazioni/incontro-pubblico-relativo-all-efficientamento-e-risparmio-energetico/65502-1-ita-IT/Incontro-pubblico-relativo-all-efficientamento-e-risparmio-energetico.jpg,"Continua l’impegno delle amministrazione di Castello-Molina di Fiemme, Capriana e Valfloriana, nell’informare e sensibilizzare i cittadini al risparmio energetico e all’assunzione di uno stile di vita consapevole e attento.",,2018-05-15T16:00:00+02:00,2018-05-22T23:00:00+02:00,,"21 e 22 maggio 2018","Teatro Parrocchiale Capriana  e Sala anziani Valfloriana",,,,,,,,"Evento singolo",,,,,,0,0,,
8ce00ff27f75eefab676c8f21d7ee5f4,2018-05-14T21:35:32+02:00,2018-05-15T16:32:51+02:00,"TORNEO DI PALLAVOLO",,/var/valfloriana/storage/images/territorio/eventi-e-manifestazioni/torneo-di-pallavolo/65457-1-ita-IT/TORNEO-DI-PALLAVOLO.png,"Aperte le iscrizioni per il torneo di pallavolo.. una giornata in compagnia da concludersi con la cena al RIstorante Villaggio.",,2018-05-15T14:00:00+02:00,2018-05-20T23:30:00+02:00,,"19 maggio 2018","Campetto multisport Villaggio",,,,,,,,"Evento singolo",,,,,,0,0,,
38169125f3bfd0726c82f74c15865328,2018-05-14T21:31:37+02:00,2018-05-15T16:32:01+02:00,"ASSEGNAZIONE LEGNA DI PARTE",,/var/valfloriana/storage/images/territorio/eventi-e-manifestazioni/assegnazione-legna-di-parte/65432-1-ita-IT/ASSEGNAZIONE-LEGNA-DI-PARTE.png,"Raccolta domande &quot,legna de part&quot, direttamente al custode forestale.",,2018-05-12T10:00:00+02:00,2018-05-25T18:00:00+02:00,"Fino al 25 maggio",,Valfloriana,,,,,,,,"Evento singolo",,,,,,0,0,,
3a84abf3abc99f4b4481a7366241dda1,2020-01-10T10:04:29+01:00,2020-01-10T10:04:29+01:00,"SESSIONE FORESTALE 2020",,/var/valfloriana/storage/images/territorio/eventi-e-manifestazioni2/sessione-forestale-2020/83058-1-ita-IT/SESSIONE-FORESTALE-2020.jpg,"Le Sessioni forestali assumono la valenza di riunioni pubbliche nel corso del quale di da conto dell'attività dell'annata trascorsa, si programmano gli interventi futuri, ci si confronta e si discute sulle problematiche di carattere forestale e ambientale di interesse.Si allegano i moduli per le richieste di assegno di piante da parte di privati ed il modulo richiesta assistenza tecnica progetti di taglio 020 (da consegnare il giorno della Sessione For.le o far pervenire al più presto all'Ufficio Distretturale di Cavalese tramite il Custode Paolo Pedron)",,2020-01-15T17:00:00+01:00,2020-01-15T19:00:00+01:00,2,"Mercoledì 15 gennaio 2020","Sala consiliare Comune di Valfloriana",,,,,,,,"Evento singolo",,,,,,0,0,,
2916e99c575523551d98ca1537241a1b,2019-09-24T18:06:48+02:00,2019-09-24T18:06:48+02:00,"LA BADANTE DEL NONO",,/var/valfloriana/storage/images/territorio/eventi-e-manifestazioni2/la-badante-del-nono/80461-1-ita-IT/LA-BADANTE-DEL-NONO.png,"
Bepi, detto Ciaspa, avanti negli anni, è proprietario dell’albergo
Mille Fiori, attualmente gestito dalla figlia Rosina, coadiuvata dal
marito Luigi e dai figli Pasquale e Concetta. Bepi è imparentato con
persone di Ragusa, essendo sua moglie, morta da 5 anni, originaria
di lì e rimasta incinta durante il tempo trascorso in quella città da
Bepi come militare. Recentemente è stato colpito da un ictus, per
fortuna non molto grave, che lo ha reso temporaneamente disabile. Al rientro a casa dall’ospedale, la famiglia gli “impone” la
presenza di una badante, che lui non vorrebbe. La badante è una
bella signora di 35 anni. Naturalmente la famiglia si trasforma e
ne succedono di cotte e di crude, per giungere alla fine dopo uncammino con i risvolti del giallo a una soluzione da… scoprire",,2019-10-26T20:30:00+02:00,2019-10-26T23:59:00+02:00,,"26 OTTOBRE 2019","TEATRO COMUNALE CASATTA",,,,,,,,Manifestazione,"Circolo Culturale Valfloriana - 16^ Rassegna teatrale",,,,,0,0,,
8295b4cea614203f0fb07d126418cb44,2019-07-18T16:43:14+02:00,2019-07-18T16:43:14+02:00,"Concerto dell' Orchestra di Fisarmoniche - Città di Arco",,/var/valfloriana/storage/images/territorio/eventi-e-manifestazioni2/concerto-dell-orchestra-di-fisarmoniche-citta-di-arco/78292-1-ita-IT/Concerto-dell-Orchestra-di-Fisarmoniche-Citta-di-Arco.jpg,"Ingresso gratuito - in caso di maltempo il concerto si terrà al Teatro Comunale di Valfloriana",,2019-08-10T20:00:00+02:00,2019-08-10T23:59:00+02:00,,"10 Agosto 2019","Casatta di Valfloriana, piazza del Municipio",,,,,,,,"Evento singolo",,,,,,0,0,,
a63959126c3ae976b7d2ef4bd28a9e48,2023-10-27T10:15:15+02:00,2023-10-27T10:15:15+02:00,"RASSEGNA TEATRALE VALFLORIANA - ","Basta parlar male dele done",https://s3-eu-west-1.amazonaws.com/static.comunitatrentina.it/var/valfloriana/storage/images/territorio/eventi-e-manifestazioni2/basta-parlar-male-dele-done/132028-1-ita-IT/Basta-parlar-male-dele-done.png,"
Si tratta di una commedia in dialetto in tre atti. Il testo è
stato scritto dal presidente della Filolevico - Claudio Pasquini - nell’autunno del 2013 con l’intento di metterla
in scena, con la Filolevico, in occasione della festa della
donna.Lo spettacolo racconta la storia di due uomini che si dilettano a parlar male delle donne in generale e delle loro consorti che, oltre al lavorare presso una casa di riposo, si dedicano alle faccende domestiche, allo shopping famigliare, etc. 
L’assenza delle mogli per una vacanza al mare permette al destino di giocare un brutto scherzo ai due signori maschi. Tante risate ma anche lo spunto per una riflessione sul mondo femminile.Con: Nicola Libardoni, Claudio Pasquini, Alberto Girardi.",,2023-10-28T20:30:00+02:00,2023-10-29T23:00:00+01:00,,,,,,,,,,,Manifestazione,"Circolo Culturale Valfloriana - 18^ Rassegna teatrale",,,,,0,0,,
875c4273d5203fa704c8dc69027437a6,2023-10-27T10:17:24+02:00,2023-10-27T10:17:24+02:00,"18a RASSEGNA TEATRALE 2023 - 2024","BASTA PARLAR MALE DELE DONE",https://s3-eu-west-1.amazonaws.com/static.comunitatrentina.it/var/valfloriana/storage/images/territorio/eventi-e-manifestazioni2/basta-parlar-male-dele-done2/132053-1-ita-IT/BASTA-PARLAR-MALE-DELE-DONE.png,"
Si tratta di una commedia in dialetto in tre atti. Il testo è
stato scritto dal presidente della Filolevico - Claudio Pasquini - nell’autunno del 2013 con l’intento di metterla
in scena, con la Filolevico, in occasione della festa della
donna.Lo spettacolo racconta la storia di due uomini che si dilettano a parlar male delle donne in generale e delle loro consorti che, oltre al lavorare presso una casa di riposo, simdedicano alle faccende domestiche, allo shopping famigliare, etc. L’assenza delle mogli per una  vacanza al mare permette al destino di giocare un brutto scherzo ai due signori maschi. Tante risate ma anche lo spunto per una riflessione sul mondo femminile.Con: Nicola Libardoni, Claudio Pasquini, Alberto Girardi",,2023-10-28T10:16:00+02:00,2023-10-28T23:00:00+02:00,,,,,,,,,,,Manifestazione,,,,,,0,0,,
b920771da9a540e3f5c0b0ad4b3391e6,2018-10-23T16:31:59+02:00,2023-10-27T10:24:16+02:00,"Rassegna teatrale 2023-2024","Circolo Culturale Valfloriana - 18^ Rassegna teatrale",https://s3-eu-west-1.amazonaws.com/static.comunitatrentina.it/var/valfloriana/storage/images/territorio/eventi-e-manifestazioni2/circolo-culturale-valfloriana-18-rassegna-teatrale/circolo-culturale-valfloriana-18-rassegna-teatrale/69556-9-ita-IT/Circolo-Culturale-Valfloriana-18-Rassegna-teatrale.jpg,"

	
	
		
			PIEGHEVOLE
		 
		3,03 MB
	

	

Il Circolo Culturale Valﬂoriana è stato fondato nell’agosto 2003 da un gruppo di amici di Valﬂoriana, con l’intento di organizzare dellemanifestazioni culturali e di intrattenimento, oltre a creare momenti di aggregazione e svago. Questa iniziativa è stata subito sostenuta dall’Amministrazione comunale, la quale per cominciare ci ha messo a disposizione le infrastrutture necessarie e un contributo economico.
Abbiamo cominciato a organizzare corsi di computer, di lingua inglese, di ginnastica, intrattenimenti per i bambini, mostre, spettacoli.Nel periodo invernale ha preso forma una mini rassegna di teatro dialettale, che nel corso degli anni si è consolidata e ampliata, trovando un crescente interesse da parte del pubblico sia locale sia valligiano e diventando un punto di riferimento per coloro che apprezzano questo genere di spettacoli.  
BIGLIETTO INGRESSOIntero 
  
  7 euro
  
  Bambini fino ai 12 anni 
  
  gratis
  
   
  
   
  


 ",,2023-10-28T20:30:00+02:00,2024-04-13T23:00:00+02:00,"stagione 2023/2024",,"Teatro comunale di Valfloriana (Casatta)",,,,,,,,Manifestazione,,,,,,0,0,,
