Titolo,Tipo di evento,Date ed orari dell'evento,Descrizione breve,Descrizione completa,Luogo dell'evento,lat,lon,address,Presenti all'evento,Organizzatori,Informazioni sugli organizzatori
STIVEREST - LA STORIA DI WALTER ANGELINI,Evento culturale,,Docufilm di Mauro Zattera e Donato Riccadonna,"La Sez. SAT di Brentonico è un’associazione che fa parte del CAI nazionale e da molti anni è costituita in sezione locale con un notevole numero di soci. Si occupa della manutenzione di sentieri sul Baldo, garantisce l’ospitalità con rifugio in quota, promuove numerose attività culturali, corsi d’alpinismo, e iniziative nelle scuole ed effettua attività di conoscenza e rispetto della montagna.  ",Palazzo Eccheli Baisi,,,,,"Comune di Brentonico
SAT - Società Alpinisti Tridentini, sezione di Brentonico",
SERATA CON L'ALPINISTA MAURIZIO GIORDANI,Evento culturale,,Il richiamo dell'Ignoto - Montagne dal mondo,"La Sez. SAT di Brentonico è un’associazione che fa parte del CAI nazionale e da molti anni è costituita in sezione locale con un notevole numero di soci. Si occupa della manutenzione di sentieri sul Baldo, garantisce l’ospitalità con rifugio in quota, promuove numerose attività culturali, corsi d’alpinismo, e iniziative nelle scuole ed effettua attività di conoscenza e rispetto della montagna.  CAUSA PREVISIONI METEO AVVERSE, L'EVENTO SI SVOLGERA' PRESSO IL TEATRO MONTE BALDO",Palazzo Eccheli Baisi,,,,,"SAT - Società Alpinisti Tridentini, sezione di Brentonico
Comune di Brentonico",
IO VI ACCUSO. GIACOMO MATTEOTTI E NOI,Evento culturale,,"L’AUTORE CONCETTO VECCHIO, GIORNALISTA DI REPUBBLICA, PRESENTA IL LIBRO:IO VI ACCUSO. GIACOMO MATTEOTTI E NOI","Nel suo paese natale, Fratta Polesine, Giacomo Matteotti, ucciso dal fascismo, è stato per oltre sessant'anni ricordato con una iscrizione censurata. Nel 1950, con Mario Scelba ministro dell'Interno, non fu permesso di scrivere che «senza pace attende il giorno della giustizia riparatrice». Solo da un decennio la frase è riapparsa in piazza, ma quel desiderio di giustizia resta in attesa, perché nell'Italia repubblicana Matteotti è ancora solo il nome di una via. E invece la sua vita, per noi oggi, è più importante della sua morte. Per questo Concetto Vecchio si è messo sulle sue tracce, leggendo le carte degli interventi parlamentari e le lettere d'amore alla moglie Velia, ma anche viaggiando attraverso l'Italia, dalla casa natale nel Polesine alla tomba, dal palazzo del quartiere Flaminio da cui uscì per l'ultima volta alle aule del parlamento in cui viene discussa la proposta di Liliana Segre per le celebrazioni del centenario della morte. In questa vera e propria inchiesta giornalistica emerge il ritratto psicologico di un uomo intransigente, risoluto, ma anche inquieto, modernissimo, dalla parte degli ultimi, che affronta Benito Mussolini a viso aperto. Con l'occhio al presente e il cuore rivolto alle giovani generazioni, Vecchio ripercorre non solo la biografia di Matteotti, ma anche la lotta di coloro che, a volte difficoltosamente, hanno cercato di salvaguardare la sua memoria: dalla coppia romana che senza chiedere niente a nessuno ha deciso di ricordarlo con una targa commemorativa, agli studiosi che hanno curato i suoi scritti, da Franco Nero che lo interpretò al cinema fino al toccante incontro con la nipote Laura Matteotti nella Roma di oggi. Io vi accuso è uno scavo nella ferita pubblica e privata del più grave delitto politico del Ventennio: una storia che ci interpella anche adesso.",Palazzo Eccheli Baisi,,,,,,
GINO BARTALI - EROE SILENZIOSO,Evento culturale,,Luna e GNAC Teatro,"Gino Bartali, a soli ventiquattro anni, incarna il ciclismo eroico degli anni ’30. Protagonista assoluto, ha un grande sogno: vincere Giro d’Italia e Tour de France nello stesso anno. Ma la Storia, incarnata nel Fascismo, entra prepotentemente a cambiare per sempre la sua carriera. La sua vita sportiva viene piegata ai voleri e alle mire del Duce, che vede in Gino Bartali l’ambasciatore azzurro del fascismo nel mondo. Ma Bartali non ci sta, ed è qui che inizia la pagina meno nota della vita di Ginettaccio, che aderisce come
staffetta alla rete clandestina organizzata dall’arcivescovo di Firenze Elia Dalla Costa.Una corsa giusta, nella speranza che il mondo cambi e ritrovi il suo senso. Per parlare dell’Italia e degli italiani al tempo del fascismo, della fatica dello sport e del silenzio delle azioni più coraggiose. Per raccontare la vita di un campione sportivo, ma soprattutto di un uomo che ha scelto da che parte stare.",Cinema Teatro Monte Baldo,0.0,0.0,,,,
